Product Name,Category,Price,Number of Reviews,Average Rating,Product Rank
SOFTSPUN Microfiber Cloth - 4 pcs - 40x40 cms - 340 GSM Grey- Thick Lint & Streak-Free Multipurpose Cloths - Automotive Microfibre Towels for Car Bike Cleaning Polishing Washing & Detailing.,Amazon Launchpad,269.0,76418.0,4.3,1
"Desidiya ® 20 Photo Clip LED String Lights for Photo Hanging, Birthday, Festival, Wedding, Party for Home, Patio, Lawn, Restaurants Home Decoration (Warm White)",Amazon Launchpad,199.0,21211.0,4.1,2
"Fixderma Shadow Sunscreen SPF 30+ Gel Sunscreen For Oily Skin, Sun Screen Protector SPF 30 For Body & Face, Broad Spectrum For UVA & UVB Protection Non Greasy & Water Resistant For Unisex, 40g",Amazon Launchpad,186.0,4755.0,4.3,3
"Be Bodywise Biotin Hair Gummies for Stronger, Shinier Hair & Nails | 60 Day Pack | With High Potency Biotin, Zinc, Folic Acid & Multivitamins | Strawberry Flavored | No Added Sugar | 60 Gummies",Amazon Launchpad,908.0,6955.0,4.0,4
"SOFTSPUN Microfiber Cleaning Cloths, 4pcs 40x40cms 340GSM Multi-Colour! Highly Absorbent Lint and Streak Free Multi -Purpose Wash Cloth for Kitchen Car Window Stainless Steel Silverware.",Amazon Launchpad,247.0,22498.0,4.3,5
"Sirona Reusable Menstrual Cup for Women | Medium Size with Pouch | Ultra Soft, Odour & Rash Free|100% Medical Grade Silicone|No Leakage|Protection for Up to 8-10 Hours | US FDA Registered,Pack of 1",Amazon Launchpad,258.0,25593.0,4.3,6
INDIGENOUS HONEY Raw Organic Honey NMR Tested NPOP Organic Certified Pure Natural Unprocessed Original Honey - 530 g Glass Jar (Pack of 1),Amazon Launchpad,521.0,14211.0,4.3,7
"ALPINO Natural Peanut Butter Crunch 400g - 100% Roasted Peanuts - 30g Protein, No Added Sugar & Salt, non-GMO, Gluten Free, Vegan – Plant Based, Unsweetened Peanut Butter Crunchy",Amazon Launchpad,149.0,26043.0,4.2,8
"Frido Dual Gel Heavy Duty Trimmable Insoles, For Loose Shoes or Replacing Existing Insoles, Thick Shoe Inserts, Extra Comfort and Support, Proudly Made in India, (Size 9-13 UK) - Pack of 1 Pair",Amazon Launchpad,799.0,3410.0,3.8,9
"Man Matters Biotin Hair Gummies | 60 Days Pack | With Biotin, Vitamin A, C, E, Zinc & DHT Blocker | Added Sugar | Keeps Hair Healthy & Strong | Strawberry Flavored |100% Vegetarian | 60 Gummies",Amazon Launchpad,799.0,4169.0,3.8,10
Vooki Ecofriendly Hard Stains Spray and Wipe for Toughest House Hold Stains 500 Ml - (Pack of 2),Amazon Launchpad,565.0,2466.0,3.9,11
"Zlade Ballistic LITE Manscaping Body Trimmer for Men | Beard, Body, Pubic Hair Grooming | Private Part Shaving | Waterproof, AAA Battery Powered | Travel Lock - 3 Second Long Press to Start",Amazon Launchpad,,3822.0,4.2,12
SOFTSPUN Microfiber Cloth - 5pcs - 40x40cms - 340GSM Multi-Color - Thick Lint & Streak-Free Multipurpose Cloths - Automotive Microfibre Towels for Car Bike Cleaning Polishing Washing & Detailing,Amazon Launchpad,319.0,27685.0,4.3,13
"Desidiya® 5 Meter 300 Led 5050 Premium RGB Led Strip with Free Adapter/Connector/Driver for Diwali Home Decoration, False Ceiling with 2A Adapter,16 Multicolour (RGB Led Strip Pack of 1)",Amazon Launchpad,649.0,7107.0,4.0,14
"Sirona Sanitary Disposal Bags | 45 Bags | Pad Disposable Bags for Discreet Disposal of Tampons, Condoms, Diaper, Sanitary Pads, Panty Liner & Personal Hygiene Waste (Green)",Amazon Launchpad,149.0,2528.0,4.3,15
"ASGARD Nonwoven Fabric Disposable Multilayer Protective Mask (Black, Pack of 50) for Unisex",Amazon Launchpad,199.0,8634.0,4.3,16
"Sirona Disposable Underarm Sweat Pads for Men and Women, 24 Pads (Pack of 1) | Peel-off | Prevents Stains, Absorbs Sweat & Unpleasant Odour",Amazon Launchpad,199.0,6019.0,4.0,17
"Sirona Reusable Face Razor for Women Facial Hair- 3 Razors | Painless Facial Hair Removal | Eyebrow Shaper | For Eyebrows, Upper Lip, Forehead, Peach Fuzz, Chin and Sideburns | Dermaplaning Tool",Amazon Launchpad,195.0,4884.0,4.2,18
"SOFTSPUN Microfiber Basic Cleaning Cloths, 8 pcs 40x40cms 280GSM Multicolor! Highly Absorbent Lint and Streak Free Multipurpose Wash Cloth for Kitchen Car Window Stainless Steel Silverware.",Amazon Launchpad,337.0,8140.0,4.3,19
"What's Up Wellness Biotin Beauty Skin & Hair Gummies,for Hair Growth, Bright Skin & Strong Nails, Vitamin A to E, Folic Acid, Zinc, Aloe Vera etc, for Men & Women, 30 Days Pack (30 Gummies)",Amazon Launchpad,699.0,1753.0,3.9,20
"Vooki Ecofriendly Tough Lime Scale Hard Water Stain Remover, Spray and Scrub Cleaner for Bathroom,Taps, Faucet, Basins, Showers & Floor Tiles Cleaner- 500 ml (Pack of 2)",Amazon Launchpad,568.0,2318.0,3.8,21
"Sirona Reusable Blink & Glow Face Razor for Women - 1 Razor | Painless Facial Hair Removal | Eyebrow Shaper | For Eyebrows, Upper Lip, Forehead, Peach Fuzz, Chin and Sideburns | Dermaplaning Tool",Amazon Launchpad,89.0,4066.0,4.1,22
"Phool Pack of 2 Natural Incense Cones, Good Vibes Pack (80 Organic Dhoop Cones | 2 Fragrances- Indian Rose & White Cedar)+2 Free Ceramic Holder | Dhoop for Pooja |Sulpher & Charcoal Free | 100% Organic (500 GMS) I Goodvibe Cone",Amazon Launchpad,275.0,1006.0,4.3,23
"SOFTSPUN 900 GSM, Microfiber Double Layered Cloth 40x40 Cms 2 Piece Towel Set, Extra Thick Microfiber Cleaning Cloths Perfect for Bike, Auto, Cars Both Interior and Exterior.",Amazon Launchpad,309.0,9019.0,4.0,24
PEE BUDDY Disposable Toilet Seat Covers - 20 Sheets | No Direct Contact with Unhygienic Seats | Easy To Dispose | Nature Friendly | Must Have for Women and Men,Amazon Launchpad,129.0,6473.0,4.2,25
"Vooki Ecofriendly Hard Stains Spray and Lime Scale Stain Descaler Remover Spray, 500 Ml Each - (Combo Pack of 2)",Amazon Launchpad,567.0,750.0,3.9,26
Nourish Mantra Hair Finishing Stick | Your Go-To Hair Fixer | Non-Greasy and Non-Sticky | Does not Leaves A White Cast | A Must-Have Hair Accessory | For Men & Women Both | 12 ml,Amazon Launchpad,349.0,296.0,3.9,27
"ASGARD Melt-Blown Fabric Disposable Face Mask with Nose Clip (Blue, Pack of 100) for Unisex",Amazon Launchpad,299.0,38105.0,4.2,28
"Sirona Reusable Menstrual Cup for Women | Large Size with Pouch|Ultra Soft, Odour and Rash Free|100% Medical Grade Silicone |No Leakage | Protection for Up to 8-10 Hours | US FDA Registered,Pack of 1",Amazon Launchpad,258.0,12670.0,4.2,29
"Phool Pack of 2 Natural Incense Cones, Meditation Pack (80 Organic Dhoop Cones | 2 Fragrances- Nagchampa & Patchouli) +2 Ceramic Holder |Dhoop for Pooja |Sulpher & Charcoal Free | 100% Organic (500 GMS) I Meditation Cone",Amazon Launchpad,275.0,1148.0,4.2,30
(Refurbished) Philips HI114 1000-Watt Golden American Heritage Soleplate Dry Iron (White),Amazon Renewed,,24193.0,4.3,1
"Echo Dot (3rd Gen), Certified Refurbished, Black – Improved smart speaker with Alexa – Like new, backed with 1-year warranty",Amazon Renewed,,6026.0,4.2,2
Lenovo (Refurbished) Thinkcentre Desktop Mini Pc (Intel Core I5 6Th Gen|8 Gb Ddr4 Ram|512 Gb Ssd|Wifi|Windows 11|Ms Office)Black,Amazon Renewed,,475.0,3.9,3
(Refurbished) boAt Airdopes 131 Truly Wireless Bluetooth In Ear Earbuds with Mic (Midnight Blue),Amazon Renewed,999.0,2287.0,3.3,4
"Echo Dot (3rd Gen), Certified Refurbished, Grey – Improved smart speaker with Alexa – Like new, backed with 1-year warranty",Amazon Renewed,,1150.0,4.1,5
"(Refurbished) ASUS Chromebox 3 High Performance Mini PC (Intel Core i7 8th gen, 16 GB DDR4 RAM, 512 GB SSD, Windows 11, WiFi, MS Office|Intel HD Graphics|USB Type-C,HDMI,4K), Black",Amazon Renewed,,440.0,4.1,6
"Lenovo (Renewed) Thinkcentre M700 Desktop Mini Pc (Intel Core I3 6Th Gen,8 Gb Ddr4 Ram,256 Gb Ssd,Wifi,Windows 11,Ms Office,Intel Hd Graphics,Usb,Dp)Black",Amazon Renewed,,203.0,4.0,7
Lenovo (Renewed) Thinkcentre Desktop Mini Pc (Intel Core I5 6Th Gen|16 Gb Ddr4 Ram|256 Gb Ssd|Wifi|Windows 11|Ms Office)Black,Amazon Renewed,,189.0,3.7,8
(Renewed) Logitech H111 Stero Wired Over Ear Headphones With Mic Black,Amazon Renewed,521.0,424.0,3.8,9
"(Refurbished) JBL Tune 215BT in-Ear Wireless Bluetooth Headphones with Mic, 16 Hours Playtime, Deep Bass",Amazon Renewed,,1210.0,3.6,10
"(Refurbished) DELL Latitude 5490 Core i5 8th Gen Laptop, 16 GB RAM, 512GB SSD, Intel HD Graphics, 14 inch (36.83 cms) HD Screen, Windows 11 (Upgraded), MS Office, Black, Slim",Amazon Renewed,,389.0,3.3,11
"(Refurbished) Fire-Boltt Phoenix Bluetooth Calling Smartwatch 1.3"",120+ Sports Modes, 240*240 PX High Re",Amazon Renewed,,940.0,3.8,12
"(Refurbished) HP w100 480p/30 Fps Webcam, Built-in Mic, Plug and Play, Wide-Angle View for Video Calling",Amazon Renewed,550.0,105.0,3.9,13
"(Refurbished) DELL Latitude 5490 Core i5 8th Gen Laptop, 8 GB RAM, 256GB SSD, Intel HD Graphics, 14 inch",Amazon Renewed,,70.0,3.7,14
Certified Refurbished Fire TV Stick Lite with Alexa Voice Remote Lite | Stream HD Quality Video | No power and volume buttons,Amazon Renewed,,545.0,4.0,15
(Renewed) Logitech B170 Wireless Mouse (Black),Amazon Renewed,330.0,570.0,4.0,16
"(Refurbished) Lenovo ThinkPad T450 Intel Core i5-5300U 14 inches Business Laptop Computer, 8GB RAM, 256GB SSD, Windows 10, 1.1925Kg, 1.1925Kg",Amazon Renewed,,530.0,3.0,17
"(Refurbished) DELL Latitude 5490 Core i5 7th Gen Laptop, 16 GB RAM, 512GB SSD, Intel HD Graphics, 14 inch (36.83 cms) HD Screen, Windows 11 (Upgraded), MS Office, Black, Slim",Amazon Renewed,,216.0,3.6,18
"(Refurbished) Nokia 2660 Flip 4G Volte keypad Phone with Dual SIM, Dual Screen, inbuilt MP3 Player & Wir",Amazon Renewed,,131.0,3.7,19
"(Refurbished) Lenovo ThinkPad T470 7th Gen Intel Core i5 Thin & Light HD Touchscreen Laptop (8 GB DDR4 RAM/256 GB SSD/14"" (35.6 cm) HD/Windows 11/MS Office/WiFi/Bluetooth 4.1/Webcam/Intel Graphics)",Amazon Renewed,,100.0,3.0,20
(Refurbished) Redgear Cosmo 7.1 Gaming Wired Over Ear Headphones With Mic Black & Blue,Amazon Renewed,699.0,474.0,4.2,21
"(Refurbished) boAt Airdopes 402 Bluetooth Truly Wireless In Ear Earbuds with BT V5.0, Advanced Touch Con",Amazon Renewed,,252.0,3.2,22
(Renewed) JBL C100SI Wired In Ear Headphone with Mic (Black),Amazon Renewed,418.0,2469.0,3.9,23
(Refurbished) PHILIPS Audio TAE1126 Wired In Ear Earphones with Mic (Black),Amazon Renewed,172.0,57.0,3.3,24
"(Refurbished) Nokia C12 Android 12 (Go Edition) Smartphone, All-Day Battery, 4GB RAM (2GB RAM + 2GB Virtual RAM) + 64GB Capacity | Light Mint",Amazon Renewed,,3.0,1.6,25
(Refurbished) CP Plus 1080P Full HD Smart WiFi Camera |360° with Pan & Tilt | View and Talk | Motion Ale,Amazon Renewed,,108.0,3.3,26
"(Renewed) MI Women's Smart Band 5 India's No. 1 Fitness Band, 1.1-inches AMOLED Color Display, Magnetic Charging, 2 Weeks Battery Life, Personal Activity Intelligence (PAI), Health Tracking (Black)",Amazon Renewed,,1297.0,3.3,27
(Refurbished) MI Xiaomi Wireless Home Security Camera 2i 2022 Edition | Full HD Picture | 360° View | 2M,Amazon Renewed,,58.0,3.8,28
"(Refurbished)JBL Wave 200 True Wireless In ear Earbuds with Mic, 20 Hours Playtime, Deep Bass Sound, Dua",Amazon Renewed,,174.0,3.3,29
"(Refurbished) Lenovo ThinkPad 6th Gen Intel Core i5 Thin & Light HD Laptop (8 GB RAM/256 GB SSD/14"" (35.6 cm)/Windows 11/MS Office/WiFi/Bluetooth 4.0/Webcam/Intel HD Graphics)",Amazon Renewed,,148.0,3.4,30
Volume Control for Lite | Control TV Volume from Stick's Remote without IR,Apps for Android,99.0,663.0,3.8,1
PixFolio - Google Photos and Slideshows,Apps for Android,299.0,1865.0,3.8,2
AirReceiver,Apps for Android,179.8,20020.0,3.9,3
ScreenCast - Miracast and Google Cast Receiver,Apps for Android,179.0,704.0,3.1,4
AirPlayMirror Receiver,Apps for Android,149.0,1987.0,3.3,5
tinyCam PRO - Swiss knife to monitor IP cam,Apps for Android,304.97,3930.0,3.0,6
Download Manager for Fire TV,Apps for Android,67.47,3197.0,3.9,7
IP Cam Viewer Full,Apps for Android,247.55,1676.0,3.6,8
gFolio - Google Drive Photos & Slideshows,Apps for Android,299.0,292.0,3.7,9
LocalsTV - The media content you love from the people you love,Apps for Android,10.0,346.0,4.2,10
AirPin PRO - AirPlay & DLNA,Apps for Android,336.31,3553.0,3.6,11
Video Player for Android TV,Apps for Android,200.0,28.0,3.3,12
DG Image Viewer,Apps for Android,65.1,51.0,3.3,13
AirPlay Cast for Fire TV - Airplay Receiver,Apps for Android,412.34,17.0,2.2,14
Mountain Legends - Full Version,Apps for Android,109.59,246.0,3.4,15
DualScreen,Apps for Android,49.79,1146.0,3.4,16
SEGA Classics,Apps for Android,,3548.0,4.1,17
Sideload Folder: TV Launcher,Apps for Android,246.97,1.0,4.0,18
Stickman Army : Team Battle for TV,Apps for Android,199.0,,,19
EML Reader,Apps for Android,166.8,3.0,0.0,20
Chess for the TV,Apps for Android,140.0,319.0,3.7,21
Pocket Rally,Apps for Android,61.79,1372.0,3.7,22
Old Movies - Hollywood classic movies,Apps for Android,199.0,1164.0,3.9,23
Clock Screensaver,Apps for Android,99.0,39.0,3.1,24
Photo Viewer for Android TV,Apps for Android,200.0,24.0,2.0,25
TDUK APP Killer,Apps for Android,164.16,589.0,4.0,26
myTuner Radio Pro,Apps for Android,179.96,519.0,3.2,27
Mountain Legends 2 - Gamepad Edition,Apps for Android,110.33,463.0,3.0,28
SkyFolio - OneDrive Photos & Slideshows,Apps for Android,299.0,234.0,4.0,29
TDUK APP Cache Cleaner (FireOS7),Apps for Android,150.0,850.0,4.3,30
"MamyPoko Pants Standard Baby Diapers, Large (L), 30 Count, 9-14 Kg",Baby Products,327.0,36995.0,4.2,1
"Pampers All round Protection Pants Style Baby Diapers, Medium (M) Size, 76 Count, Anti Rash Blanket, Lotion with Aloe Vera, 7-12kg Diapers",Baby Products,922.0,243466.0,4.3,2
"Huggies Complete Comfort Wonder Pants, Double Extra Large (15-25kg) Size,(48 count) Baby Diaper Pants, Combo Pack of 2, 24 count Per Pack, (48 count) with 5 in 1 Comfort",Baby Products,882.0,186367.0,4.2,3
"Pampers Premium Care Pants Style Baby Diapers, Medium (M) Size, 54 Count, All-in-1 Diapers with 360 Cottony Softness, 7-12kg Diapers",Baby Products,897.0,58270.0,4.4,4
"Himalaya Total Care Baby Pants Diapers, Medium (M), 78 Count, (7 - 12 kg), With Anti-Rash Shield, Indian Aloe Vera and Yashad Bhasma, Silky Soft Inner Layer",Baby Products,698.0,67433.0,4.1,5
"Little's Baby Pants Diapers,Large (L), 9-14 kg, 60 Count, with Wetness Indicator and 12 Hours Absorption",Baby Products,584.0,68543.0,4.0,6
"Little's Soft Cleansing Baby Wipes with Aloe Vera, Jojoba Oil and Vitamin E (80 wipes) pack of 3",Baby Products,213.0,111367.0,4.4,7
"Supples Premium Diapers, Large (L), 62 Count, 9-14 Kg, 12 hrs Absorption Baby Diaper Pants",Baby Products,519.0,130584.0,4.0,8
"Bumtum Baby Diaper Pants, XL Size, 54 Count, Double Layer Leakage Protection Infused With Aloe Vera, Cottony Soft High Absorb Technology (Pack of 1)",Baby Products,499.0,6234.0,3.7,9
"Mee Mee Caring Baby Wet Wipes with lid, 72 Pcs (Aloe Vera, Pack of 3)",Baby Products,178.0,56267.0,4.3,10
"Pampers Active Baby Tape Style Baby Diapers, New Born/Extra Small (NB/XS) Size, 72 Count, Adjustable Fit with 5 star skin protection, Up to 5kg Diapers",Baby Products,978.0,49566.0,4.4,11
"Himalaya Powder For Baby, 700G",Baby Products,287.0,47149.0,4.0,12
"LuvLap Pant Style Baby Diapers, X-Large (XL), 54 Count, For babies of Upto 12-17Kg with Aloe Vera Lotion for rash protection, with upto 12hr protection, Diapers",Baby Products,678.0,16804.0,4.0,13
"Cerelac Nestlé Baby Cereal with Milk, Wheat Apple – From 6 Months, 300g BIB Pack",Baby Products,250.0,36276.0,4.4,14
Himalaya Baby Shampoo (400 ml),Baby Products,238.0,49351.0,4.4,15
"Little Angel Extra Dry Baby Pants Diaper, Large (L) Size, 96 Count, Super Absorbent Core Up to 12 Hrs. Protection, Soft Elastic Waist Grip & Wetness Indicator, Pack of 2, 48 count/pack, 8-14kg",Baby Products,891.0,42997.0,3.9,16
"Bumtum Chota Bheem Medium Baby Diaper Pants, 72 Count, Leakage Protection Infused With Aloe Vera, Cottony Soft High Absorb Technology (Pack of 1)",Baby Products,489.0,895.0,3.8,17
NOVEL Baby Wet Wipes/Pack With Lid (Pack of 6-80 Sheet),Baby Products,295.0,1955.0,4.4,18
Mother Sparsh 99% Pure Water (Unscented) baby wipes I Natural Plant made cloth - Super thick I 72 pcs/pack - Pack of 2 (Super Saver Pack),Baby Products,399.0,10940.0,4.0,19
"LuvLap Paraben Free wipes for baby skin with Aloe Vera, Fragrance Free, pH Balanced, Dermatologically Safe, Baby Wipes Rich in Vitamin E & chamomile extract, 72 Wipes / Pack With Lid Pack, 3 packs",Baby Products,209.0,49784.0,4.3,20
"Supples Baby Wet Wipes with Aloe Vera and Vitamin E - 72 Wipes/Pack, (Pack of 3)",Baby Products,179.0,61958.0,4.4,21
"Himalaya Gentle Baby Wipes With Indian Lotus & Aloe Vera, 72 Wipes (Pack of 2) | Plant Based Fabric | 100% Biodegradable | Skin Friendly pH | Clinically Tested",Baby Products,238.0,43982.0,4.4,22
"Himalaya Baby Body Lotion, For All Skin Types (400 ml)",Baby Products,217.0,61493.0,4.4,23
Himalaya Gentle Baby Soap (75g),Baby Products,110.0,25602.0,4.4,24
Mee Mee Mild Baby Liquid Laundry Detergent (1.2 L - Refill Pack),Baby Products,389.0,5114.0,4.0,25
Sebamed Baby Gentle Wash 400ml|Ph 5.5| With Allantoin| No tears formula |Clinically tested,Baby Products,800.0,14122.0,4.6,26
Himalaya Face Body Oil Baby Massage Oil For All Skin Types (500 ML),Baby Products,311.0,38023.0,4.4,27
Sebamed Baby Cleansing Bar 100g|Ph 5.5 | With Panthenol|No tears & Soap Free bar| For Delicate skin,Baby Products,276.0,14831.0,4.4,28
Tedibar Moisturising Baby Bar 75g(Pack of 2),Baby Products,315.0,16611.0,4.4,29
Sebamed Baby Body Lotion 400 ml|Ph 5.5|Camomile & Allantoin| Dermatalogically tested| Sensitive skin,Baby Products,,18303.0,4.0,30
"Mi Step Out 12 L Mini Backpack (Small Size, Black, Water Repellant)","Bags, Wallets and Luggage",229.0,9837.0,4.1,1
Boldfit Shoe Bag for Travel & Storage Travel Organizer for Women & Men Travel Accessories Shoe Organizer Shoe Bags Pouches Travel Shoe Cover for Travelling Travel Essentials - Pack of 6 Shoe Pouch,"Bags, Wallets and Luggage",199.0,2484.0,4.4,2
"GLUN Bolt Electronic Portable Fishing Hook Type Digital LED Screen Luggage Weighing Scale, 50 kg/110 Lb (Black)","Bags, Wallets and Luggage",272.0,21416.0,4.0,3
WildHorn Leather Wallet for Men I Ultra Strong Stitching I 6 Credit Card Slots I 2 Currency Compartments I 1 Coin Pocket,"Bags, Wallets and Luggage",285.0,37233.0,4.0,4
House of Quirk Polyester Packing Cubes 7 Pcs Travel Luggage Packing Organizers Set With Toiletry Bag (Grey),"Bags, Wallets and Luggage",749.0,1692.0,4.1,5
"Zemic Portable Auto Travel Umbrella - Umbrellas for Rain Windproof, Strong & Easy Auto Open/Close Button for Single Use Umbrella for Wind and Rain, Perfect Car Umbrella for Men & Women","Bags, Wallets and Luggage",499.0,833.0,4.8,6
"Urban Forest Oliver Black Leather Wallet For Men, 6 Card Slot","Bags, Wallets and Luggage",499.0,12472.0,4.3,7
WildHorn Green Leather Wallet for Men I 9 Card Slots I 2 Currency & Secret Compartments I 1 Zipper & 3 ID Card Slots,"Bags, Wallets and Luggage",458.0,28683.0,4.0,8
American Tourister Fizz Large Size 32 Ltrs Casual Backpack (BLACK),"Bags, Wallets and Luggage",,55599.0,4.0,9
GoTrippin Metal Luggage Weighing Scale Digital (Silver_ELS),"Bags, Wallets and Luggage",799.0,9970.0,4.4,10
Sfane Polyester 23cms Duffle/Shoulder/Gym Bag for Men & Women with Separate Shoe Compartment (Grey),"Bags, Wallets and Luggage",387.0,8045.0,4.3,11
"Urban Forest Oliver Blue Leather Wallet For Men, 6 Card Slot","Bags, Wallets and Luggage",499.0,43100.0,4.3,12
"Trajectory Travel Neck Pillow Rest Cushion for Travel in Flight car Train Airplane with 2 Years Warranty for Sleeping for Men and Women (Grey, Polyester)","Bags, Wallets and Luggage",299.0,19600.0,3.9,13
Skybags Brat Black 46 Cms Casual Backpack,"Bags, Wallets and Luggage",672.0,5766.0,4.1,14
Billebon Premium Neck Pillow Eye Mask Combo Airplane Travel Pillow with Comfortable Velvet Sleeping Eyemask Head Rest Pillow & 30 Years Warranty (Grey Neck Pillow with Eye Mask),"Bags, Wallets and Luggage",329.0,6413.0,3.9,15
"Storite Dust & Rain Cover for Backpack with Pouch, Waterproof Dustproof Rain Cover Bag Elastic Adjustable for School, College,Office, Trekking Bags (30L-35L,Black)","Bags, Wallets and Luggage",179.0,313.0,4.2,16
NIVIA Basic Duffle Polyester Bag/Gym Bags/Adjustable Shoulder Bag for Men/Duffle Gym Bags for Men/Fitness Bag/Carry Bags/Sports & Travel Bag/Sports Kit/Duffle Bags Travel,"Bags, Wallets and Luggage",269.0,3931.0,3.9,17
Lavie Sport Lino Large Size 63 cms Wheel Duffle Bag for Travel | Travel Bag with Trolley,"Bags, Wallets and Luggage",,8464.0,3.9,18
M MEDLER Epoch Nylon 55 litres Waterproof Strolley Duffle Bag- 2 Wheels - Luggage Bag - (Navy Blue),"Bags, Wallets and Luggage",549.0,25786.0,3.0,19
"Amazon Brand - Solimo Rain & Dust Cover for Backpack (30 Litres, Black)","Bags, Wallets and Luggage",229.0,9181.0,4.2,20
"Boldfit Weight Machine For Luggage Weighing Scale, Luggage Weight Machine Weighing Machine For Luggage With LCD Display Luggage Weighing Scale","Bags, Wallets and Luggage",499.0,1104.0,4.2,21
"Rigohill Doger Olive Green Leather Wallet For Men, 2 Card Slot | RFID Wallet","Bags, Wallets and Luggage",499.0,5339.0,4.1,22
"Fur Jaden 55 LTR Rucksack Travel Backpack Bag for Trekking, Hiking with Shoe Compartment","Bags, Wallets and Luggage",849.0,5681.0,4.2,23
Storite PU Leather 9 Slot Vertical Credit Debit Card Holder Money Wallet Zipper Coin Purse for Men Women - Lightbrown (11.5 x 1.75 x 8 cm),"Bags, Wallets and Luggage",499.0,7875.0,4.1,24
NAPA HIDE Leather Wallet for Men I Handcrafted I Multiple Credit/Debit Card Slots I 2 Currency Compartments I 2 Secret Compartments,"Bags, Wallets and Luggage",299.0,32802.0,3.9,25
Safari Compact Size 15 Ltrs Casual Backpack For Unisex Adult - Sea Blue,"Bags, Wallets and Luggage",329.0,20727.0,4.0,26
AL FASCINO Wallets for men leather original purses for men rfid wallet for men leather wallet for men money purse for men Wallet Mens wallet men wallet gents wallets wallet for men card holder for men gents wallets,"Bags, Wallets and Luggage",474.0,9858.0,4.1,27
"Wolpin Pack of 10 Pcs Shoe Bag Cover for Shoe Storage & Travelling Drawstring Bags Waterproof, White","Bags, Wallets and Luggage",249.0,1217.0,4.4,28
"Voltonix Umbrella Automatic Open Travel Umbrella with Wind Vent,Umbrella big size for men, Umbrella for girls, Umbrellas for rain,Windproof Umberalla Large for Man,Women (Blue)","Bags, Wallets and Luggage",449.0,2.0,0.0,29
Fur Jaden Brown Textured Leatherette Stylish & Spacious Weekender Duffle Bag for Travel,"Bags, Wallets and Luggage",899.0,6599.0,4.3,30
"Dettol Original Germ Protection Bathing Soap Bar (600gm) | Kills 99.99% germs, 125gm + 20% Extra Free, Pack of 4",Beauty,215.0,21170.0,4.4,1
"Himalaya Purifying Neem Face Wash, 400 Ml",Beauty,289.0,87488.0,4.3,2
"Cetaphil Face Wash Gentle Skin Cleanser for Dry to Normal, Sensitive Skin, 125 ml Hydrating Face Wash with Niacinamide, Vitamin B5",Beauty,283.0,25335.0,4.3,3
"The Derma Co 1% Hyaluronic Sunscreen Aqua Ultra Light Gel with SPF 50 PA++++ For Broad Spectrum, UV A, UV B & Blue Light Protection - 50g(dermaco)",Beauty,448.0,10133.0,4.3,4
Dettol Liquid Handwash Refill – Skincare Hand Wash- 1500ml | pH Balanced | 10x Better Germ Protection,Beauty,193.6,41456.0,4.0,5
Ice Face Roller Silicone Facial Cube for Eyes Neck Massage Remove Dark Circle Pore Shrink Face Beauty Skin Care Ice Mould Kitchen Tools,Beauty,49.0,1235.0,3.0,6
Dettol Liquid Handwash Refill - Original Hand Wash- 675ml (Pack of 2) | Germ Defence Formula | 10x Better Germ Protection,Beauty,198.0,79345.0,4.0,7
"Pears Pure & Gentle Soap Bar (Combo Pack of 5) - With Glycerin for Soft, Glowing Skin & Body, Paraben-Free Body Soaps For Bath Ideal for Men & Women",Beauty,305.76,42754.0,4.0,8
"Aqualogica Glow+ Dewy Sunscreen SPF 50 PA+++ For UVA/B & Blue Light Protection, for Glowing & Well Protected Skin, Cream, 50G",Beauty,343.0,7750.0,4.3,9
"Minimalist 2% Salicylic Acid Face Wash For Oily Skin | Sulphate Free, Anti Acne Face Cleanser With Lha & Zinc For Acne Or Pimples | Men & Women 100 Ml",Beauty,299.0,9839.0,4.1,10
"Garnier Skin Naturals, Face Serum, Increases Skin's Glow Instantly and Reduces Spots Overtime, Bright Complete Vitamin C Booster, 30 ml",Beauty,389.0,26652.0,4.0,11
Simple Kind To Skin Refreshing Facial Wash 150 ml,Beauty,308.0,13054.0,4.3,12
NIVEA Nourishing Body Milk 400ml Body Lotion | 48 H Moisturization | With 2X Almond Oil | Smooth and Healthy Looking Skin |For Very Dry Skin,Beauty,300.0,87989.0,4.4,13
"Dettol Skincare Moisturizing Beauty Bathing Soap Bar with Argan Oil (600gm) | Softer Skin, 125gm + 20% Extra Free, Pack of 4",Beauty,225.0,3529.0,4.4,14
Minimalist Sunscreen SPF 50 Lightweight with Multi-Vitamins | No White Cast | Broad Spectrum PA ++++ | For Women & Men | 50g,Beauty,399.0,13845.0,4.1,15
Mamaearth Onion Shampoo for Anti Hair Fall & Hair Growth with Onion Oil & Plant Keratin 400ml,Beauty,323.0,45234.0,4.0,16
"Mysore Sandal Soap,450g (150x3) (Pack Of 3)",Beauty,232.0,26556.0,4.0,17
"L'Oreal Paris Shampoo, For Damaged and Weak Hair, With Pro-Keratin + Ceramide, Total Repair 5, 1ltr",Beauty,545.0,33587.0,4.3,18
"Nat Habit - Fresh Ready To Apply Henna Paste, Pre-Soaked in Black Tea and Herbs,100% Natural Rajasthani Henna, Imparts Rich Brown Shade (Pack of 2 x 220g)",Beauty,339.0,1218.0,4.0,19
"Bella Vita Luxury Woman Eau De Parfum Gift Set 4x20 ML for Women with CEO, Honey Oud, Glam,Rose Perfume|Floral,Fruity Long Lasting EDP Fragrance Scent",Beauty,565.0,8864.0,4.3,20
"Garnier, Hair Colouring Creme, Long-lasting Colour, Smoothness & Shine, Color Naturals, Shade: 1 Natural Black, 70ml + 60g",Beauty,200.0,25857.0,4.2,21
"L'Oréal Paris Permanent Hair Colour, Radiant At-Home Hair Colour with up to 100% Grey Coverage, Pro-Keratin, Up to 8 Weeks of Colour, Excellence Crème, 1 Black, 72ml+100g",Beauty,578.0,16139.0,4.3,22
"L'Oreal Paris Serum, Protection and Shine, For Dry, Flyaway & Frizzy Hair, With 6 Rare Flower Oils, Extraordinary Oil, 30ml",Beauty,245.0,26038.0,4.3,23
"L'Oreal Paris Moisture Sealing Conditioner, With Hyaluronic Acid, For Dry & Dehydrated Hair, Adds Shine & Bounce, Hyaluron Moisture 72H, 180ml",Beauty,167.0,4493.0,4.3,24
