Product Name,Category,Price,Number of Reviews,Average Rating,Product Rank
"Ross Round Hair Scalp Massager Shampoo Hair Brush, Super Soft Bristles, Exfoliating, Anti-Dandruff (Light Green)",Beauty,99.0,2505.0,4.2,25
"L'Oréal Paris Semi-Permanent Hair Colour, Ammonia-Free Formula & Honey-Infused Conditioner, Glossy Finish, Casting Crème Gloss, Darkest Brown 300, 87.5g+72ml",Beauty,630.0,28417.0,4.2,26
"Bella Vita Luxury Man Perfume Gift Set 4x20 ML for Men with Dominus, Oud, CEO, Impact Perfume|Woody, Citrusy Long Lasting EDP & EDC Fragrance Scent",Beauty,565.0,14349.0,4.0,27
Indulekha Bringha Ayurvedic Hair Oil 100 ml|| Hair Fall Control and Hair Growth with Bringharaj & Coconut Oil - Comb Applicator Bottle for Men & Women,Beauty,301.0,60985.0,4.1,28
"Soulflower Rosemary Essential Oil for Hair Growth, Hair Fall Control and Nourishment, Skin Care | Clinically Tested & Ecocert Certified Organic 100% Pure, Natural, Undiluted | 15ml",Beauty,399.0,13822.0,4.2,29
"Cetaphil Oily Skin Cleanser , Daily Face Wash for Oily, Acne prone Skin , Gentle Foaming, 125ml",Beauty,506.0,7945.0,4.3,30
"The Psychology Of Money, Author: Morgan Housel",Books,267.0,53729.0,4.6,1
"Shrimad Bhagwat Geeta Yatharoop, Author: A.C. Bhaktivendanta Swami Prabhupada",Books,230.0,16904.0,4.8,2
"Atomic Habits, Author: James Clear",Books,395.0,83210.0,4.6,3
"Hindus in Hindu Rashtra (Eighth-Class Citizens and Victims of State-Sanctioned Apartheid), Author: Anand Ranganathan",Books,198.0,463.0,4.9,4
"My First Library: Boxset of 10 Board Books for Kids, Author: Wonder House Books",Books,399.0,72245.0,4.0,5
"Ikigai, Author: Francesc Miralles",Books,285.0,50042.0,4.6,6
"Rich Dad Poor Dad: 25th Anniversary Edit, Author: Robert T. Kiyosaki",Books,339.0,25041.0,4.6,7
"Do It Today: Overcome procrastination, improve productivity and achieve more meaningful things [Paperback] Foroux, Darius, Author: Darius Foroux",Books,125.0,7285.0,4.4,8
"Indian Polity for UPSC (English| 7th Edition) |Civil Services Exam| State Administrative Exams, Author: M Laxmikanth",Books,729.0,272.0,4.0,9
"Don't Believe Everything You Think (English), Author: Joseph Nguyen",Books,180.0,2446.0,4.6,10
"BlackBook of English Vocabulary March 2023 by Nikhil Gupta, Author: Nikhil K.R. Gupta",Books,307.0,1353.0,4.0,11
"The Power of Your Subconscious Mind, Author: Joseph Murphy",Books,115.0,77095.0,4.0,12
"My First Book of Patterns Pencil Control: Practice Patterns (Pattern Writing), Author: Wonder House Books",Books,89.0,25440.0,4.4,13
"NTA UGC NET /SET/JRF Paper 1, Teaching and Research Aptitude – 2023, Includes latest 2022 paper and 2600+ Practice Questions with Solutions | Includes NEP - 2020| 7th Edition - By Pearson, Author: KVS Madaan",Books,349.0,429.0,4.4,14
"Brain Activity Book for Kids - 200+ Activities for Age 3+, Author: Maple Press",Books,100.0,4170.0,4.4,15
"Bhagvad Gita As It Is English New Edition, Author: A. C. Bhaktivedanta Swami Prabhupad",Books,349.0,5998.0,4.8,16
"Grandma's Bag of Stories: Collection of 20+ Illustrated short stories, traditional Indian folk tales for all ages for children of all ages by Sudha Murty [Paperback] Sudha Murty, Author: Murty Sudha",Books,165.0,19837.0,4.6,17
"THE 48 LAWS OF POWER, Author: Robert Greene",Books,489.0,17532.0,4.6,18
"My First Mythology Tale (Illustrated) (Set of 5 Books) - Mahabharata, Krishna, Hanuman, Ganesha, Ramayana - Story Book for Kids - English Short Stories with Colourful Pictures - Read Aloud to Infants, Toddlers, Author: Maple Press",Books,179.0,7574.0,4.4,19
"THE SILENT PATIENT [Paperback] Michaelides, Alex, Author: Alex Michaelides",Books,213.0,264941.0,4.0,20
"Oswaal CBSE Class 10 Science Question Bank (For 2024 Board Exams), Author: Oswaal Editorial Board",Books,473.0,345.0,4.4,21
"Arihant All In One Class 10th Social Science for CBSE Exam 2024, Author: Aditya Raj",Books,347.0,264.0,4.3,22
"Oxford Student Atlas for India, Fourth Edition - Useful for Competitive Exams, Author: Oxford University Press",Books,296.0,19732.0,4.6,23
"Man's Search For Meaning: The classic tribute to hope from the Holocaust, Author: Victor E. Frankl",Books,212.0,81170.0,4.0,24
"Think Straight: Change your thoughts, Change your life [Paperback] Foroux, Darius, Author: Darius Foroux",Books,125.0,12123.0,4.2,25
"World's Greatest Pack for Personal Growth and Wealth (Set of 4 Books), Author: Dale Carnegie",Books,325.0,24594.0,4.0,26
"Sank Magic Practice Copybook, (4 BOOK + 10 REFILL+ 2 Pen +2 Grip) Number Tracing Book for Preschoolers with Pen, Magic Calligraphy Copybook Set Practical Reusable Writing Tool Simple Hand Lettering, Author: snak",Books,117.5,747.0,3.9,27
"Word Power Made Easy [Paperback] Norman Lewis, Author: Norman Lewis",Books,106.0,47061.0,4.4,28
"Bhagavad Gita [Deluxe Hardbound Edition] Sacred Text for Self-Realization and Spiritual Enlightenment | Discover Ancient Wisdom | Timeless Religious Teachings | Book on India’s Vedic Wisdom, Author: Anonymous",Books,219.0,1629.0,4.7,29
"MTG Objective NCERT at your FINGERTIPS Biology - NCERT Notes with HD Pages, Based on NCERT Exam Archive Questions, NEET Books (Latest & Revised Edition 2023-2024), Author: MTG Editorial Board",Books,627.0,656.0,4.4,30
SOFTSPUN Microfiber Cloth - 4 pcs - 40x40 cms - 340 GSM Grey- Thick Lint & Streak-Free Multipurpose Cloths - Automotive Microfibre Towels for Car Bike Cleaning Polishing Washing & Detailing.,Car & Motorbike,269.0,76418.0,4.3,1
"Involve Your Senses One Musk Organic Car Perfume, Involve Your Senses Strong Fiber Air Freshener to Freshen'up Your Car - IONE01-40 g,Car Accessories interior car perfumes and fresheners",Car & Motorbike,335.0,20601.0,3.8,2
"ShineXPro Microfiber Car Cleaning Cloth - OG Soft 500 GSM Extra Large (35x75 CM) Microfiber Cloth for Car and Bike - Suede Edging for Scratchless Drying and Detailing (Pack of 2, Grey)",Car & Motorbike,499.0,7853.0,4.3,3
"Pidilite WD-40, Multipurpose Car care Spray, 420ml Rust Remover, Lubricant, Stain Remover, Powerful Chimney Cleaner, Degreaser, and Bike Chain Cleaner & Chain Lube (341g)",Car & Motorbike,375.0,37641.0,4.3,4
"ORJILO Super Soft Microfiber Car Duster Exterior with Extendable Handle, Car Brush Duster for Car Cleaning Dusting - Grey",Car & Motorbike,296.0,4841.0,4.0,5
HSR Car Accessories in 10PCS/1Set Car Wiper Detergent Effervescent Tablets Washer Auto Windshield Cleaner Glass Wash Cleaning Tablets,Car & Motorbike,159.0,19367.0,3.9,6
SOFTSPUN Microfiber Cloth - 5pcs - 40x40cms - 340GSM Multi-Color - Thick Lint & Streak-Free Multipurpose Cloths - Automotive Microfibre Towels for Car Bike Cleaning Polishing Washing & Detailing,Car & Motorbike,319.0,27685.0,4.3,7
"Steelbird SBA-7 7Wings ISI Certified Flip-Up Helmet for Men and Women with Inner Smoke Sun Shield Outer Clear Visor ( Large 600 MM, Dashing Black )",Car & Motorbike,,13122.0,4.2,8
"AutokraftZ Black Uv Sunblock protection with thumb hole Arm sleeves for unisex_2 | New Arm Sleeves |Arm Sleeves For Driving, Cycling, Tennis, Cricket, Football, Golf, Outdoor, Gym, Riding, Sun Protection Cooling Arm Sleeves for Men",Car & Motorbike,69.0,7721.0,3.0,9
Liqui Moly Car Polish and Wax (250 ml),Car & Motorbike,,38.0,4.0,10
Motul C2 Chain Lube for All Bikes (150 ml),Car & Motorbike,237.0,22643.0,4.4,11
ARNV Universal Body Cover with Mirror Pockets for Bike | Grey and Silver,Car & Motorbike,209.0,476.0,3.0,12
3M Foaming Car Interior Cleaner (580 g) | Upholstery & Leather cleaner | Removes tough stains & dirt inside your car,Car & Motorbike,655.0,13636.0,4.1,13
"Auto Hub Heavy Microfiber Cloth for Car Cleaning and Detailing, Double Sided, Extra Thick Plush Microfiber Towel Lint-Free, 800 GSM (Size 40cm x 40cm)/Pack of 3, Color: Grey",Car & Motorbike,320.0,7943.0,4.3,14
"SOFTSPUN Microfiber Basic Cleaning Cloths, 8 pcs 40x40cms 280GSM Multicolor! Highly Absorbent Lint and Streak Free Multipurpose Wash Cloth for Kitchen Car Window Stainless Steel Silverware.",Car & Motorbike,337.0,8140.0,4.3,15
Boldfit Face Mask for Bikers in Riding Full Face Mask Balaclava for Men Black Mask for Bike Riding Accessories Cycling Accessories Stylish Mask for Men and Women Rider Full Face Helmet Mask for Men,Car & Motorbike,249.0,950.0,4.3,16
Godrej aer Twist – Car Air Freshener | Car Accessories | Cool Surf Blue (45g),Car & Motorbike,359.0,16774.0,3.8,17
Motul Combo of C2 Chain Lube (150 ml) and C1 Chain Clean for All Bikes (150 ml) (LBCH001),Car & Motorbike,488.0,16514.0,4.4,18
"SOFTSPUN 900 GSM, Microfiber Double Layered Cloth 40x40 Cms 2 Piece Towel Set, Extra Thick Microfiber Cleaning Cloths Perfect for Bike, Auto, Cars Both Interior and Exterior.",Car & Motorbike,309.0,9019.0,4.0,19
Jopasu Car Duster,Car & Motorbike,765.0,35023.0,4.4,20
"3M Car Wash Shampoo, 250ml | High Foam Car Cleaning | Remove tough dirt | Safe on paint",Car & Motorbike,274.0,10076.0,4.3,21
3M Car Dashboard Dresser (250 ml) | Restore Gloss on Dashboard and other plastic parts | Protection from UV rays & fading,Car & Motorbike,325.0,12866.0,4.2,22
3M Car wash Shampoo (1L) | High Foam | Remove tough dirt | Safe on paint,Car & Motorbike,673.0,14805.0,4.4,23
"Ambi Pur Car Freshener Gel, Relaxing Lavender, 75 g",Car & Motorbike,254.0,7058.0,3.6,24
AutoBizarre High Gloss Anti Scratch Black Carbon Fiber Paint Protection Film Tape PPF for Car Protection and Decoration - 2 Inches x 5 Meters,Car & Motorbike,399.0,1940.0,4.0,25
"Motomax 2K Rubbing Compound 100g | Removes Minor Scratches, Swirl Marks, Paint defect and Oxidization from metal surfaces on Cars, Bike, Motorbikes | Removes dirt, grime, stains to make surface glossy",Car & Motorbike,64.0,1062.0,3.0,26
"Vega Atom ISI Certified Smooth Matt Finish Open Face Helmet for Men and Women with Clear Visor(Dull Black, Size:M)",Car & Motorbike,910.0,22583.0,4.2,27
Godrej aer O – Hanging Car Air Freshener | Car Accessories | Cool Aqua (7.5g),Car & Motorbike,99.0,1.0,0.0,28
Vega Multipurpose Cable Lock Black,Car & Motorbike,186.0,2874.0,4.1,29
Asian Paints ezyCR8 Apcolite Enamel Paint Spray (Black Matte) Multi-Surface DIY Spray Paint for metal wood wall – 250 g (400ml) Can,Car & Motorbike,158.0,3095.0,3.7,30
London Hills Solid Men's Round Neck Cotton Blend Half Sleeve T-Shirts,Clothing & Accessories,189.0,1892.0,3.7,1
Jockey 1406 Women's High Coverage Super Combed Cotton Mid Waist Hipster with Concealed Waistband and StayFresh Treatment (Pack of 3_Colors & Prints May Vary),Clothing & Accessories,455.0,32341.0,4.2,2
ANNI DESIGNER Women's Cotton Blend Printed Straight Kurta with Pant,Clothing & Accessories,469.0,3833.0,3.0,3
"Raj Fancy Dresses Shri Krishna Dress for Baby Boy & Girl, Janmashtmi Dress with Diaper-friendly Dhoti & Dupatta, Mor Pankh Mukut",Clothing & Accessories,899.0,4613.0,4.2,4
Dennis Lingo Men's Solid Slim Fit Cotton Casual Shirt with Spread Collar & Full Sleeves (Also Available in Plus Size),Clothing & Accessories,489.0,32827.0,3.8,5
KOTTY Women Polyester Blend Green Solid Trousers,Clothing & Accessories,329.0,2452.0,3.6,6
"Mehrang Lycra Saree Shapewear Petticoat for Women, Cotton Blended,Petticoat,Skirts for Women,Shape Wear Dress for Saree",Clothing & Accessories,350.0,5267.0,4.2,7
Amazon Brand - Symbol Men's Regular Fit Polo Shirt,Clothing & Accessories,399.0,24116.0,3.9,8
GoSriKi Women's Cotton Blend Printed Straight Kurta with Pant (PS-Pink-CMD-GS),Clothing & Accessories,469.0,478.0,3.7,9
GoSriKi Women's Cotton Blend Embroidered Straight Kurta (Stho-White-Nw2-GS),Clothing & Accessories,469.0,1136.0,3.9,10
HSR Women Waist Shapewear with Anti Rolling Strip Tummy Control Tucker Waist Slimming Panties Shapewear Underwear Waist Shapewear,Clothing & Accessories,327.0,5345.0,4.0,11
MEERA FAB Women's Cotton Printed Anarkali Kurta With Palazzo & Dupatta Set,Clothing & Accessories,748.0,2918.0,3.9,12
Selvia Men's Solid Lycra Full Elastic Jogger Track Pant,Clothing & Accessories,189.0,939.0,3.2,13
Van Heusen Men's Regular Fit Polo Shirt,Clothing & Accessories,699.0,32423.0,4.0,14
Allen Solly Men Polo,Clothing & Accessories,689.0,64079.0,4.1,15
Jockey 1410 Women's Medium Coverage Super Combed Cotton Mid Waist Bikini with Concealed Waistband (Pack of 3_Colors & Prints May Vary),Clothing & Accessories,500.0,26171.0,4.1,16
rytras Women's Cotton Printed Straight Kurta and Pant Set,Clothing & Accessories,529.0,40.0,4.7,17
ANNI DESIGNER Women's Cotton Blend Straight Printed Kurta with Pant & Dupatta,Clothing & Accessories,699.0,398.0,3.6,18
Jockey Women Shorties,Clothing & Accessories,329.0,9122.0,4.3,19
Jockey 8037 Men's Super Combed Cotton Solid Brief with Ultrasoft Waistband (Pack of 2),Clothing & Accessories,398.0,8676.0,4.2,20
"Fear-less Generic Tape Double Sided Tape for Industrial, Walls, Fashion and Body Uses- Multi Purpose Uses -50 Count (Packaging May Vary, 2023 MODEL)",Clothing & Accessories,80.0,33475.0,3.7,21
London Hills Men Round Neck Cotton Blend Multicolor Half Sleeve Solid T-Shirts (Pack of 3),Clothing & Accessories,499.0,5802.0,3.8,22
Levi's Men Brief,Clothing & Accessories,315.0,18500.0,3.9,23
Jockey 1722 Women's Wirefree Non Padded Super Combed Cotton Elastane Stretch Medium Coverage Everyday Bra with Concealed Shaper Panel and Adjustable Straps,Clothing & Accessories,489.0,11863.0,4.2,24
Adidas Original Flat Knit Ankle Cotton Socks - 3 Pairs (6N) (AD-203) (Col Navy/Grey Mel/Black),Clothing & Accessories,399.0,2391.0,4.3,25
XYXX Traq Trunk for Men,Clothing & Accessories,399.0,6492.0,4.1,26
Lux Cozi Men's White Round Neck Sleeveless Cotton Vest (Pack of 3),Clothing & Accessories,330.0,7062.0,4.2,27
KLOSIA Women Printed Kurta and Pant set with Dupatta,Clothing & Accessories,,507.0,4.0,28
Van Heusen Women Antibacterial Cotton Hipster Panty - Pack of 3,Clothing & Accessories,429.0,13288.0,4.2,29
GoSriKi Women's Rayon Straight Printed Kurta with Pant & Dupatta,Clothing & Accessories,659.0,994.0,3.8,30
"STRIFF Laptop Stand for Desk, Ergonomic Computer Stand Laptop Riser, Phone and Tablet Stand for Desk, Portable Laptop Elevator Holder Compatible with MacBook, Laptop,Tablet(WhiteSky)",Computers & Accessorties,199.0,652.0,3.7,1
"Ambrane Unbreakable 60W / 3A Fast Charging 1.5m Braided Type C Cable for Smartphones, Tablets, Laptops & other Type C devices, PD Technology, 480Mbps Data Sync, Quick Charge 3.0 (RCT15A, Black)",Computers & Accessorties,149.0,51171.0,4.0,2
Toy Imagine Multicolor LCD Writing Tablet 8.5 inches Screen Kids LCD Tablet with Pen,Computers & Accessorties,129.0,485.0,3.7,3
"Portronics Toad 23 Wireless Optical Mouse with 2.4GHz, USB Nano Dongle, Optical Orientation, Click Wheel, Adjustable DPI(Black)",Computers & Accessorties,299.0,6457.0,4.0,4
"Logitech B170 Wireless Mouse, 2.4 GHz with USB Nano Receiver, Optical Tracking, 12-Months Battery Life, Ambidextrous, PC/Mac/Laptop - Black",Computers & Accessorties,595.0,67871.0,4.3,5
"HP v236w USB 2.0 64GB Pen Drive, Metal, Silver",Computers & Accessorties,399.0,73006.0,4.2,6
STRIFF Adjustable Laptop Tabletop Stand Patented Riser Ventilated Portable Foldable Compatible with MacBook Notebook Tablet Tray Desk Table Book with Free Phone Stand (Black),Computers & Accessorties,323.0,31661.0,4.3,7
LAPSTER Spiral Charger Spiral Charger Cable Protectors for Wires Data Cable Saver Charging Cord Protective Cable Cover Set of 3 (12 Pieces),Computers & Accessorties,59.0,14504.0,4.1,8
"STRIFF Mpad Mouse Mat 230X190X3mm Gaming Mouse Pad, Non-Slip Rubber Base, Waterproof Surface, Premium-Textured, Compatible with Laser and Optical Mice(Universe Black)",Computers & Accessorties,99.0,5301.0,4.4,9
Oakter Mini UPS for 12V WiFi Router Broadband Modem | Backup Upto 4 Hours | WiFi Router UPS Power Backup During Power Cuts | UPS for 12V Router Broadband Modem | Current Surge & Deep Discharge Protection,Computers & Accessorties,,19223.0,4.2,10
Redgear MP35 Speed-Type Gaming Mousepad (Black/Red),Computers & Accessorties,129.0,17772.0,4.6,11
SanDisk Cruzer Blade 32GB USB Flash Drive,Computers & Accessorties,299.0,257875.0,4.3,12
"Dell MS116 1000Dpi USB Wired Optical Mouse, Led Tracking, Scrolling Wheel, Plug and Play.",Computers & Accessorties,309.0,36944.0,4.4,13
"Wayona Nylon Braided USB to Lightning Fast Charging and Data Sync Cable Compatible for iPhone 13, 12,11, X, 8, 7, 6, 5, iPad Air, Pro, Mini (3 FT Pack of 1, Grey)",Computers & Accessorties,399.0,28568.0,4.2,14
HP USB 2.0 Flash Drive 128GB (v236w),Computers & Accessorties,699.0,73006.0,4.2,15
"Lenovo 300 Wired Plug & Play USB Mouse, High Resolution 1600 DPI Optical Sensor, 3-Button Design with clickable Scroll Wheel, Ambidextrous, Ergonomic Mouse for Comfortable All-Day Grip (GX30M39704)",Computers & Accessorties,289.0,27731.0,4.4,16
SanDisk Cruzer Blade 64GB USB 2.0 Flash Drive,Computers & Accessorties,389.0,257875.0,4.3,17
"Zebronics-NS1500 Laptop Stand Featuring Foldable Design, Anti-Slip Silicone Rubber Pads, Supports Maximum of 5kgs Weight Tabletop",Computers & Accessorties,298.0,357.0,3.0,18
"Logitech M221 Wireless Mouse, Silent Buttons, 2.4 GHz with USB Mini Receiver, 1000 DPI Optical Tracking, 18-Month Battery Life, Ambidextrous PC/Mac/Laptop - Charcoal Grey",Computers & Accessorties,745.0,38119.0,4.4,19
"Portronics Konnect L 1.2M Fast Charging 3A 8 Pin USB Cable with Charge & Sync Function for iPhone, iPad (Grey)",Computers & Accessorties,139.0,20448.0,4.2,20
"Tizum Mouse Pad - Computer Mouse Mat with Anti-Slip Rubber Base & Smooth Mouse Control with Spill-Resistant Surface for Laptop, Notebook, MacBook Pro, Gaming Computer (9.4 * 7.9 Inches), Beta",Computers & Accessorties,99.0,7373.0,4.4,21
Sounce Cleaning Soft Brush Keyboard Cleaner 5-in-1 Multi-Function Computer Cleaning Tools Kit Corner Gap Duster Keycap Puller for Bluetooth Earphones Lego Laptop AirPods Pro Camera Lens (Red),Computers & Accessorties,89.0,2594.0,4.0,22
SanDisk SDCZ50-128G-I35 USB2.0 128 GB Pen Drive (Red and Black),Computers & Accessorties,719.0,257875.0,4.3,23
"Zebronics Zeb-Power Wired USB Mouse, 3-Button, 1200 DPI Optical Sensor, Plug & Play, for Windows/Mac",Computers & Accessorties,138.0,6892.0,4.0,24
"Callas Multipurpose Foldable Laptop Table with Cup Holder | Drawer | Mac Holder | Table Holder Study Table, Breakfast Table, Foldable and Portable/Ergonomic & Rounded Edges/Non-Slip Legs (WA-27-Black)",Computers & Accessorties,596.0,22414.0,3.9,25
Dell KB216/KB216d1 Wired Multimedia USB Keyboard with Super Quite Plunger Keys with Spill-Resistant – Black,Computers & Accessorties,569.0,32388.0,4.3,26
Canon PIXMA PG47 Black Ink Cartridge,Computers & Accessorties,667.0,9945.0,4.2,27
HP 680 Ink Cartridges Combo Pack (1 Black Cartridge + 1 tri-Color Cartridge),Computers & Accessorties,,34934.0,4.2,28
Cuzor 12V Mini ups for WiFi Router | Power Backup up to 4 Hours | Replaceable Battery | Ups for WiFi Router | WiFi Router ups up to 2A| ups for uninterrupted wi-fi| Portable ups | WiFi Ups,Computers & Accessorties,,10341.0,4.4,29
HP 680 Original Ink Advantage Cartridge (Black),Computers & Accessorties,852.0,34934.0,4.2,30
"iQOO Z7 Pro 5G (Blue Lagoon, 8GB RAM, 256GB Storage) | 3D Curved AMOLED Display | 4nm MediaTek Dimesity 7200 5G Processor | 64MP Aura Light OIS Camera | Segment's Slimmest & Lightest Smartphone",Electronics,,5898.0,,1
"realme narzo N53 (Feather Black, 4GB+64GB) 33W Segment Fastest Charging | Slimmest Phone in Segment | 90 Hz Smooth Display",Electronics,,388401.0,3.9,2
"iQOO Z7 Pro 5G (Blue Lagoon, 8GB RAM, 128GB Storage) | 3D Curved AMOLED Display | 4nm MediaTek Dimesity 7200 5G Processor | 64MP Aura Light OIS Camera | Segment's Slimmest & Lightest Smartphone",Electronics,,24488.0,,3
boAt BassHeads 100 in-Ear Wired Headphones with Mic (Black),Electronics,329.0,5898.0,4.1,4
"OnePlus Nord CE 3 Lite 5G (Chromatic Gray, 8GB RAM, 128GB Storage)",Electronics,,207222.0,4.1,5
"realme narzo N53 (Feather Gold, 4GB+64GB) 33W Segment Fastest Charging | Slimmest Phone in Segment | 90 Hz Smooth Display",Electronics,,24488.0,3.9,6
"boAt Airdopes 141 Bluetooth Truly Wireless in Ear Headphones with 42H Playtime,Low Latency Mode for Gaming, ENx Tech, IWP, IPX4 Water Resistance, Smooth Touch Controls(Bold Black)",Electronics,,126174.0,3.8,7
"OnePlus Nord CE 3 Lite 5G (Pastel Lime, 8GB RAM, 128GB Storage)",Electronics,,652.0,4.1,8
"OnePlus Bullets Z2 Bluetooth Wireless in Ear Earphones with Mic, Bombastic Bass - 12.4 Mm Drivers, 10 Mins Charge - 20 Hrs Music, 30 Hrs Battery Life (Magico Black)",Electronics,,133778.0,4.1,9
"iQOO Z7 Pro 5G (Graphite Matte, 8GB RAM, 256GB Storage) | 3D Curved AMOLED Display | 4nm MediaTek Dimesity 7200 5G Processor | 64MP Aura Light OIS Camera | Segment's Slimmest & Lightest Smartphone",Electronics,,52151.0,,10
"STRIFF Laptop Stand for Desk, Ergonomic Computer Stand Laptop Riser, Phone and Tablet Stand for Desk, Portable Laptop Elevator Holder Compatible with MacBook, Laptop,Tablet(WhiteSky)",Electronics,199.0,71805.0,3.7,11
"OnePlus Nord CE 2 Lite 5G (Black Dusk, 6GB RAM, 128GB Storage)",Electronics,,24488.0,4.2,12
"boAt Airdopes 170 TWS Earbuds with 50H Playtime, Quad Mics ENx™ Tech, Low Latency Mode, 13mm Drivers, ASAP™ Charge, IPX4, IWP™, Touch Controls & BT v5.3(Classic Black)",Electronics,,13602.0,3.8,13
"Apple 20W USB-C Power Adapter (for iPhone, iPad & AirPods)",Electronics,,51171.0,4.0,14
"OnePlus Nord CE 3 Lite 5G (Chromatic Gray, 8GB RAM, 256GB Storage)",Electronics,,166068.0,4.1,15
"boAt Airdopes Atom 81 True Wireless Earbuds with Upto 50H Playtime, Quad Mics ENx™ Tech, 13MM Drivers,Super Low Latency(50ms), ASAP™ Charge, BT v5.3(Opal Black)",Electronics,999.0,16616.0,3.6,16
"Ambrane Unbreakable 60W / 3A Fast Charging 1.5m Braided Type C Cable for Smartphones, Tablets, Laptops & other Type C devices, PD Technology, 480Mbps Data Sync, Quick Charge 3.0 (RCT15A, Black)",Electronics,149.0,207222.0,4.0,17
"boAt Rockerz 255 Pro+ Bluetooth in Ear Earphones with Upto 60 Hours Playback, ASAP Charge, IPX7, Dual Pairing and Bluetooth v5.0(Active Black)",Electronics,,47700.0,4.1,18
"Samsung Original 25W Single Port, Type-C Fast Charger, (Cable not Included), White",Electronics,,38979.0,4.4,19
"boAt Airdopes 141 Bluetooth Truly Wireless in Ear Headphones with 42H Playtime,Low Latency Mode for Gaming, ENx Tech, IWP, IPX4 Water Resistance, Smooth Touch Controls(Cyan Cider)",Electronics,,212.0,3.8,20
"Fire-Boltt Ninja Call Pro Plus 1.83"" Smart Watch with Bluetooth Calling, AI Voice Assistance, 100 Sports Modes IP67 Rating, 240 * 280 Pixel High Resolution (Black)",Electronics,,147414.0,4.2,21
"OnePlus Nord Buds 2r True Wireless in Ear Earbuds with Mic, 12.4mm Drivers, Playback:Upto 38hr case,4-Mic Design, IP55 Rating [Deep Grey]. @INR 1999 with Bank Offer",Electronics,,120677.0,4.2,22
"boAt Newly Launched Airdopes 141 ANC TWS Earbuds with 42 hrs Playback, 50 ms Low Latency BEAST™Mode, IWP™Tech,Signature Sound, Quad Mics with ENx™, ASAP™ Charge, USB Type-C Port & IPX5(Gunmetal black)",Electronics,,17457.0,3.9,23
MI Power Bank 3i 20000mAh Lithium Polymer 18W Fast Power Delivery Charging | Input- Type C | Micro USB| Triple Output | Sandstone Black,Electronics,,1418.0,4.2,24
"boAt Rockerz 450 Bluetooth On Ear Headphones with Mic, Upto 15 Hours Playback, 40MM Drivers, Padded Ear Cushions, Integrated Controls and Dual Modes(Luscious Black)",Electronics,,13602.0,4.1,25
"Noise Pulse 2 Max 1.85"" Display, Bluetooth Calling Smart Watch, 10 Days Battery, 550 NITS Brightness, Smart DND, 100 Sports Modes, Smartwatch for Men and Women (Jet Black)",Electronics,,5898.0,4.0,26
"realme narzo 60 5G (Mars Orange,8GB+128GB) 90Hz Super AMOLED Display | Ultra Premium Vegan Leather Design | with 33W SUPERVOOC Charger",Electronics,,200572.0,4.0,27
"Hit Flying Insect Killer - Mosquito & Fly Killer Spray (700Ml) | Instant Kill | Protection From Dengue & Malaria, Pack Of 1",Garden & Outdoors,331.0,19443.0,4.3,1
HIT Crawling Insect Killer – Cockroach Killer Spray (700ml) | Instant Kill | Deep-Reach Nozzle | Fresh Fragrance,Garden & Outdoors,352.0,31942.0,4.3,2
"HIT Anti Mosquito Racquet Rechargeable Insect Killer Bat with LED Light, Black",Garden & Outdoors,500.0,114563.0,3.9,3
Classic Mosquito Net for Double Bed | King Size Foldable Machardani | Polyester 30GSM Strong Net | PVC Coated Corrosion Resistant Steel Wire - Blue,Garden & Outdoors,949.0,66839.0,4.2,4
TrustBasket Organic Vermicompost Fertilizer Manure For Plants 5 Kg Green,Garden & Outdoors,309.0,20857.0,4.2,5
Shadow Securitronics BOB CAT Car Rat Repellent/Rodent Spray | 2x Advance Formula | Non- Toxic Rat Repeal Spray | Rat No Entry in Cars/Bike/Tractor | Mouse Rodent Repellent | Vehicle Mouse Repellent Spray | 200ml Rat Repellent Self Car & Vehicle Pest Control Repellent with Protective Glove & Mask | Pack of 1,Garden & Outdoors,454.0,1671.0,4.3,6
TrustBasket Rectangular Indigo Galvanized Metal Plant Stand/Pot Stand - 24 inches (Set of 4) for Indoor & Outdoor Use,Garden & Outdoors,999.0,10321.0,4.2,7
Kraft Seeds by 10CLUB Pressure Spray Pump (2L) | Gardening Water Pump Sprayer | Plant Water Sprayer for Home Garden | Spray Bottles for Garden Plants and Lawn | Plant Watering Can,Garden & Outdoors,299.0,15671.0,3.8,8
"TrustBasket Enriched Organic Earth Magic Potting Soil Fertilizer for Plants, 5 Kg",Garden & Outdoors,289.0,21140.0,4.2,9
"LifeKrafts Polyester Magnetic Mosquito Net for Door | Mosquito Curtain for All Door Types & Sizes | Auto-Closing Insect Screen to Keep Mosquito Out (200x100 cm, Brown)",Garden & Outdoors,889.0,8874.0,4.4,10
"LifeKrafts Polyester Magnetic Mosquito Net for Door | Mosquito Curtain for All Door Types & Sizes | Auto-Closing Insect Screen to Keep Mosquito Out (210x100 cms, Grey)",Garden & Outdoors,889.0,10353.0,4.4,11
"3M Rodent Repellent Coating, Rat Repellent Spray, Prevents Rat Bites in Engine Parts and Wires, Highly Effective, Leak-Free, Easy-to-Spray, Bitter Taste, No Kill-only Repels (250g, Pack of 1)",Garden & Outdoors,535.0,5595.0,3.9,12
