Product Name,Category,Price,Number of Reviews,Average Rating,Product Rank
"Pidilite Terminator Eco-Friendly Termite Killer Spray| Wood Preservative and Termite, Borer, Insect Repellant Spray| For Home, Kitchen and Offices (1 Ltr)",Garden & Outdoors,364.8,11526.0,3.8,13
Lazy Gardener Greenstix Fertilizer Sticks | Plant Food Fertilizer for Green Plants Home Garden | Fertilisers for Plant indoor Outdoor Home Garden Plants 16 Sticks,Garden & Outdoors,273.0,3409.0,3.6,14
"HIT Flying Insect Killer - Mosquito & Fly Killer Spray (700ml) | Lime Fragrance | Instant Kill | Protection from Dengue & Malaria, pack of 1",Garden & Outdoors,331.0,10955.0,4.3,15
"Lifekrafts Fiberglass Mesh & Polyester Upgraded & Stitched - Window Mosquito Net (Size-120X120 Cms/47*47 Inches/3.94*3.94 Feet, Color-Grey) 120 Gsm Fiberglass Insect Net",Garden & Outdoors,599.0,9263.0,4.4,16
"LifeKrafts Polyester Magnetic Mosquito Net for Door | Mosquito Curtain for All Door Types & Sizes | Auto-Closing Insect Screen to Keep Mosquito Out (Black, 210x100 Cms)",Garden & Outdoors,889.0,9851.0,4.4,17
Kraft Seeds by 10CLUB Assorted Hand Pruner Cutter - 1 Pc (Steel Blades) Heavy Duty Gardening Cutter Tool | Plant Cutter for Home Garden | Wood Branch Trimmer | Grass Cutting Accessory,Garden & Outdoors,185.0,20141.0,4.2,18
"Baygon Cockroach Killer Spray, 400 Ml, Pack Of 1",Garden & Outdoors,199.0,4970.0,4.0,19
"Tri-Activ Mosquito Net for Double Bed I King-Size Premium Machardani by Piramal I 30 GSM I Outdoor I Strong and Durable I Pop-up Format I Foldable I Corrosion Resistant, Blue",Garden & Outdoors,848.0,3302.0,4.0,20
Ugaoo Organic Vermicompost Fertilizer for Plants - 5 Kg,Garden & Outdoors,299.0,4022.0,4.2,21
Ugaoo Organic Potting Garden Soil Mix for Plants Home Garden 5 Kg,Garden & Outdoors,289.0,1945.0,4.2,22
"Mortein 2 in 1 Mosquito Killer & Cockroach Killer Spray - 600ml | All Insect Killer | Lemon Fragrance | 100% Kill Guarantee | Mosquito Repellent, Mosquito Spray Aerosol",Garden & Outdoors,239.0,7465.0,4.1,23
Ugaoo Cocopeat Block for Home Garden Plants 5 Kg,Garden & Outdoors,289.0,2813.0,4.3,24
Weird Wolf Rechargeable Mosquito Racket Bat with COB Light | Long Battery Life | Made in India with 6 Month Warranty (Purple),Garden & Outdoors,440.0,754.0,4.3,25
Ugaoo Cow Dung Manure Fertilizers for Plants & Home Gardening - 5 kg,Garden & Outdoors,299.0,4827.0,4.2,26
OrganicDews Liquid Seaweed Concentrate for Plants 250 ml with Measuring Cup 25 ml Fertilizer for All Indoor and Outdoor Plants 250 ml,Garden & Outdoors,242.0,16373.0,4.1,27
Leafy Tales Set of 7-Iron Indoor/Outdoor Flower Pot/Plant Stand for Home Garden Balcony Living Room Decor (Black-Set of 7) (Round Stand - 7),Garden & Outdoors,599.0,6580.0,4.3,28
"ARMORX Fiberglass Mosquito Net Pre Stitched with Fastener Tape on All Four Borders, Window/Door DIY Bug Insect Mesh-Black (3ftx4ft)",Garden & Outdoors,455.0,4074.0,4.0,29
"Chipku -Pure Cold Pressed, Water Soluble neem Oil for Spray on Plants and Garden (250 ml)…",Garden & Outdoors,299.0,5029.0,4.1,30
Google Play recharge code - Digital Voucher,Gift Cards,10.0,240202.0,4.3,1
Amazon Pay eGift Card,Gift Cards,,192962.0,4.6,2
Amazon Pay eGift Card,Gift Cards,,192962.0,4.6,3
Amazon Pay eGift Card,Gift Cards,,192962.0,4.6,4
Amazon Pay eGift Card,Gift Cards,100.0,192962.0,4.6,5
Amazon Pay eGift Card,Gift Cards,10.0,192962.0,4.6,6
Google Play Gift Code - Digital Voucher Redeemable on Play Store,Gift Cards,,28652.0,4.4,7
Amazon Pay eGift Card,Gift Cards,,192962.0,4.6,8
Amazon Pay eGift Card,Gift Cards,100.0,192962.0,4.6,9
Amazon Pay eGift Card,Gift Cards,100.0,192962.0,4.6,10
Amazon Pay eGift Card,Gift Cards,100.0,192962.0,4.6,11
Amazon Pay eGift Card,Gift Cards,,192962.0,4.6,12
BigBasket E-Gift Card - Flat 2% off - Redeemable online,Gift Cards,500.0,1907.0,4.6,13
Amazon Pay eGift Card,Gift Cards,,192962.0,4.6,14
Amazon Pay eGift Card,Gift Cards,100.0,192962.0,4.6,15
Amazon Pay eGift Card,Gift Cards,,192962.0,4.6,16
Amazon Pay eGift Card,Gift Cards,100.0,192962.0,4.6,17
Amazon Pay eGift Card,Gift Cards,,192962.0,4.6,18
Amazon Pay eGift Card,Gift Cards,,192962.0,4.6,19
Amazon Pay eGift Card,Gift Cards,100.0,192962.0,4.6,20
Amazon Pay eGift Card,Gift Cards,100.0,192962.0,4.6,21
Amazon Pay eGift Card,Gift Cards,100.0,192962.0,4.6,22
Amazon Pay-Rakshabhandan Gift Card- Premium envelope design,Gift Cards,,27.0,4.4,23
Swiggy One Lite E-Gift Card - Redeemable On Swiggy App- Flat 15% cashback up to Rs. 22,Gift Cards,149.0,11.0,3.3,24
Amazon Pay eGift Card,Gift Cards,100.0,192962.0,4.6,25
Swiggy E-gift Card - Redeemable online -Flat 2% cashback up to Rs. 300,Gift Cards,250.0,1691.0,4.6,26
Amazon Pay eGift Card,Gift Cards,100.0,192962.0,4.6,27
Amazon Pay Gift Card - Ganesha Box for Wedding/Raksha Bandhan/Good Luck,Gift Cards,,52.0,4.0,28
Amazon Pay eGift Card,Gift Cards,,192962.0,4.6,29
Uber - Redeemable Online- Flat 2% off,Gift Cards,100.0,2268.0,4.0,30
Tata Salt | Vacuum Evaporated Iodised Salt | 1 kg,Grocery & Gourmet Foods,17.0,58494.0,4.6,1
"Fortune Sunlite Refined Sunflower Oil, 1L",Grocery & Gourmet Foods,144.0,29678.0,4.4,2
"Tata Sampann Unpolished Toor Dal (Arhar Dal), 1kg",Grocery & Gourmet Foods,224.0,26140.0,4.0,3
"MAGGI 2-minute Instant Noodles, 840g (12 pouches x 70g each), Masala Noodles with Goodness of Iron, Made with Choicest Quality Spices, Favourite Masala Taste",Grocery & Gourmet Foods,158.0,69213.0,4.4,4
"Fortune Premium Kachi Ghani Pure Mustard Oil, 1Litre PET Bottle",Grocery & Gourmet Foods,277.0,25826.0,4.4,5
"Parry's White Label Sugar, 1kg",Grocery & Gourmet Foods,,20099.0,4.3,6
"Amazon Brand - Vedaka Whole Jeera (Cumin), 100g",Grocery & Gourmet Foods,,28773.0,4.4,7
"Lay's Potato Chips 50g/52g, American Style Cream & Onion Flavour, Crunchy Chips & Snacks (weight may vary)",Grocery & Gourmet Foods,,25530.0,4.4,8
"Amazon Brand - Vedaka Sooji, 500g",Grocery & Gourmet Foods,188.0,28015.0,4.2,9
"Tata Sampann Turmeric Powder With Natural Oils, 200g",Grocery & Gourmet Foods,42.0,17437.0,4.0,10
"Fortune Oil, 1 L Pouch Premium Kachi Ghani Pure Mustard",Grocery & Gourmet Foods,131.0,26643.0,4.4,11
"Aashirvaad Superior MP Atta, 10kg Pack",Grocery & Gourmet Foods,,19823.0,4.4,12
"MYFITNESS Chocolate Peanut Butter Smooth 1250g | 22g Protein | Tasty & Healthy Nut Butter Spread |Vegan| Dark Chocolate | Cholesterol Free, Gluten Free| Smooth Peanut Butter | Zero Trans Fat",Grocery & Gourmet Foods,549.0,71492.0,4.0,13
"Cadbury Oreo Vanilla Flavour Chocolatey Sandwich Biscuit, 288.75 g",Grocery & Gourmet Foods,70.0,29647.0,4.4,14
"Cerelac Nestlé Baby Cereal with Milk, Wheat Apple – From 6 Months, 300g BIB Pack",Grocery & Gourmet Foods,250.0,36276.0,4.4,15
"Tata Sampann Unpolished Moong Dal (Split), 1kg",Grocery & Gourmet Foods,180.0,13421.0,4.0,16
"Amazon Brand - Vedaka Raw Peanuts, Pink, 1kg",Grocery & Gourmet Foods,220.0,15559.0,4.3,17
"Aashirvaad Salt,with 4-Step advantage, 1kg",Grocery & Gourmet Foods,,24046.0,4.4,18
"Tata Sampann 100% Chana Dal Fine Besan, 1kg",Grocery & Gourmet Foods,125.0,18912.0,4.0,19
"Tata Sampann, High in Fibre Poha(Thick), 500g",Grocery & Gourmet Foods,,21397.0,4.4,20
Quaker Oats 2kg | Rolled Oats | 100% Natural Wholegrain | Nutritious Breakfast Cereals | Porridge | Easy to Cook,Grocery & Gourmet Foods,307.0,35047.0,4.0,21
"Cadbury Chocobakes ChocLayered Cakes, 114 g",Grocery & Gourmet Foods,45.0,14196.0,4.4,22
Girnar Food & Beverages Pvt. Ltd. Detox Green Tea - Desi Kahwa (36 Tea Bags) 90 gm,Grocery & Gourmet Foods,330.0,45801.0,4.0,23
Tata Salt Rock Salt | Premium Sendha Namak | with Natural Trace Minerals | 1kg Pouch,Grocery & Gourmet Foods,108.0,8047.0,4.0,24
"Tata Sampann Unpolished Kabuli Chana (Big Size), 500g",Grocery & Gourmet Foods,123.0,8257.0,4.0,25
"Tata Sampann Unpolished Green Moong Dal (Whole), 500g",Grocery & Gourmet Foods,60.0,10775.0,4.4,26
NeutraVed Rosemary Dried Leaf/Rosemary For Foods & Hair - 50 Gm,Grocery & Gourmet Foods,149.0,3095.0,4.3,27
Happilo 100% Natural Premium California Dried Almonds 500g Pack Pouch | Premium Badam Giri | High in Fiber & Boost Immunity | Real Nuts | Gluten Free,Grocery & Gourmet Foods,459.0,29886.0,4.2,28
"Britannia Little Hearts, 75g",Grocery & Gourmet Foods,,19692.0,4.0,29
"Amazon Brand - Vedaka Popular Toor Dal, 1kg|Rich in Protein|No Cholesterol|No Additives",Grocery & Gourmet Foods,199.0,11371.0,4.3,30
"Harpic Disinfectant Toilet Cleaner Liquid, Original - 1 Litre (Pack of 2) | Thick Toilet Cleaning Acid Suitable for Toilet Bowls",Health & Personal Care,349.0,77698.0,4.4,1
Genteel Matic Liquid Detergent Refill Pouch for Both Top load and Front load Washing - 2kg | No Soda Formula | with Added Fabric Conditioner,Health & Personal Care,220.0,35518.0,4.3,2
"Vim Dishwash Liquid Gel Lemon Refill Pouch, 2 Ltr | Dishwash Gel Infused With The Power Of Lemons | Leaves No Residue",Health & Personal Care,323.0,18582.0,4.0,3
Tide Plus Double Power Detergent Washing Powder Jasmine & Rose 6kg + 2kg FREE,Health & Personal Care,887.0,57188.0,4.4,4
Surf Excel Easy Wash Detergent Powder 5 kg | Superfine Washing Powder | Dissolves Easily & Removes Tough Stains | Suitable for all Washing Machines,Health & Personal Care,650.0,25079.0,4.4,5
Amazon Brand - Presto! 2 Ply Kitchen Tissue/Towel Paper Roll - 6 Rolls (60 Pulls Per Roll),Health & Personal Care,329.0,24557.0,4.4,6
Dettol Liquid Handwash Refill – Skincare Hand Wash- 1500ml | pH Balanced | 10x Better Germ Protection,Health & Personal Care,193.6,41456.0,4.0,7
"Dabur Red Toothpaste - 800g (200g x 4) | World's No.1 Ayurvedic Paste | Fluoride Free| Helps in Bad Breath Treatment, Cavity Protection, Plaque Removal | For Whole Mouth Health | Power of 13 Potent Ayurvedic Herbs",Health & Personal Care,281.0,55953.0,4.4,8
Dettol Liquid Handwash Refill - Original Hand Wash- 1500ml | Germ Defence Formula | 10x Better Germ Protection,Health & Personal Care,193.6,79345.0,4.0,9
"Optimum Nutrition (ON) Gold Standard 100% Whey (2 lbs/907 g) (Double Rich Chocolate) Protein Powder for Muscle Support & Recovery, Vegetarian - Primary Source Whey Isolate",Health & Personal Care,,103875.0,4.0,10
"Exo Dishwash Bar, 360g (90g x 3 +1 Bar Free)",Health & Personal Care,30.0,7443.0,4.2,11
"HIT Anti Roach Gel - Cockroach Killer (20g) | Kitchen Safe | Odourless | Fast and Convenient, Pack of 1",Health & Personal Care,234.0,49102.0,4.0,12
"Comfort Morning Fresh Fabric Conditioner 2 L Refill Pack | After Wash Liquid Fabric Softener (Offer Pack) | Softness, Shine & Long Lasting Freshness",Health & Personal Care,430.0,33897.0,4.0,13
"Dettol Antiseptic Liquid for First Aid , Surface Disinfection and Personal Hygiene , 1000ml",Health & Personal Care,354.0,22891.0,4.6,14
"Surf Excel Matic Front Load Liquid Detergent 2 L Refill Pouch, For Removing Tough Stains, Surf Excel Liquid Detergent - Front Load Washing Machines",Health & Personal Care,440.0,45288.0,4.0,15
"Centrum Women, World's No.1 Multivitamin with Biotin, Vitamin C & 21 vital Nutrients for Overall Health, Radiance, Strong Bones & Immunity (Veg) Pack of 50 tablets",Health & Personal Care,666.0,3576.0,4.2,16
Amazon Brand - Presto! Disinfectant Toilet Cleaner - 1 L (Pack of 4),Health & Personal Care,339.0,24225.0,4.2,17
"Odonil Bathroom Air Freshner Blocks Mixed Fragrances - 192g (48g*4) | Mixed Fragrances: Jasmine, Lavender, Orchid, Rose| Long Lasting Fragrance | Lasts upto 30 days",Health & Personal Care,144.0,23040.0,4.2,18
"Philips Multi Grooming Kit MG3710/65, 9-in-1 (New Model), Face, Head and Body - All-in-one Trimmer for Men Self Sharpening Stainless Steel Blades, No Oil Needed, 60 Mins Run Time",Health & Personal Care,,11680.0,4.2,19
"Surf Excel Matic Top Load Liquid Detergent 3.2 L Refill, Designed for Tough Stain Removal on Laundry in Washing Machines - Mega Pack",Health & Personal Care,505.0,1541.0,4.0,20
Amazon Brand - Solimo 3 Ply Toilet Paper/Tissue Roll - 12 Rolls (160 Pulls Per Roll),Health & Personal Care,289.0,19574.0,4.1,21
Sofy Anti Bacteria Extra Long Sanitary Pads - Slim (Pack of 48 Pads),Health & Personal Care,279.0,5543.0,4.0,22
"Urbangabru Hair Removal cream Spray | Painless Body Hair Removal spray For Chest, Back, Legs & Under Arms (200 ml) (Hair Removal Cream Spray - 200ml)",Health & Personal Care,599.0,7837.0,4.1,23
Amazon Brand - Solimo 2 Ply Kitchen Tissue Paper Roll - 4 Rolls (60 Pulls Per Roll),Health & Personal Care,229.0,18448.0,4.4,24
"Surf Excel Matic Front Load Liquid Detergent 3.2 L Refill, Designed for Tough Stain Removal on Laundry in Washing Machines - Mega Pack",Health & Personal Care,585.0,1177.0,4.0,25
"MuscleBlaze Creatine Monohydrate, Labdoor USA Certified Creatine (Unflavoured, 100 g / 0.22 lb, 33 Servings)",Health & Personal Care,549.0,25848.0,4.2,26
"Godrej aer matic, Automatic Air Freshener Spray Kit with Flexi Control - Violet Valley Bloom (225 ml) & matic, Automatic Air Freshener Kit with flexi control - Cool Surf Blue (225 ml) Combo",Health & Personal Care,,20942.0,4.1,27
"Colgate Strong Teeth, 500g, India’s No: 1 Toothpaste Brand, Calcium-boost for 2X Stronger Teeth, Prevents cavities, Whitens Teeth, Freshens Breath",Health & Personal Care,249.0,22478.0,4.4,28
Healthgenie Weight Machine for Body Weight Thick Tempered Glass LCD Display With 3 Years Warranty Weighing Scale (Sporty Red),Health & Personal Care,469.0,9625.0,4.4,29
"Vim Antismell with Pudina Buy 4 get 1, Pack of 5",Health & Personal Care,122.0,8223.0,4.4,30
"Amazon Brand - Presto! Oxo-Biodegradable Garbage Bags, Medium -(19 x 21 inches) - 30 bags/roll (Pack of 6, Black)",Home & Kitchen,319.0,34900.0,4.4,1
"MILTON Vitro Plastic Pet Storage Jar and Container, Set of 18 (6 pcs x 230 ml Each, 6 pcs x 600 ml Each, 6 pcs x 1.18 ltrs Each), Red Wine | Food Grade | Air Tight | BPA Free",Home & Kitchen,379.0,21635.0,4.4,2
BSB HOME 100% Microfiber bedsheet for Double Bed with 2 Pillow Covers Breathable | Wrinklefree and Softtouch Zigzag Print Sheet- Yellow & Blue,Home & Kitchen,209.0,4529.0,3.3,3
Ezee Black Medium Garbage Bags 90 Pcs | 19 X 21 Inch | 30 Pcs x Pack of 3 | Dustbin Trash Bag,Home & Kitchen,175.0,30565.0,4.2,4
"Presto! Oxo-Biodegradable Garbage Bags, Small - 30 bags/roll (Pack of 6, plastic, Black)",Home & Kitchen,269.0,22754.0,4.3,5
"Pigeon Polypropylene Mini Handy and Compact Chopper with 3 Blades for Effortlessly Chopping Vegetables and Fruits for Your Kitchen (12420, Green, 400 ml)",Home & Kitchen,199.0,269923.0,4.0,6
"Odonil Room Air Freshener Spray - 440ml Combo (Pack of 2, 220ml each) | Jasmine Fresh & Ocean Breeze | Nature Inspired Fragrance for Home & Office | Long Lasting Fragrance",Home & Kitchen,199.0,3071.0,4.1,7
SYSKA Tuo Portable Rechargeable Led Lamp Cum Torch with Upto 4hrs Backup (Green-White) (1),Home & Kitchen,299.0,14312.0,4.1,8
"Jialto Stainless Steel, PVC, ABS Nail Free Seamless Adhesive Non-Trace No Drilling Installation Hanging, Waterproof Screws Wall Hook (Transparent) - 10 Pack",Home & Kitchen,218.0,11469.0,4.0,9
beatXP Kitchen Scale Multipurpose Portable Electronic Digital Weighing Scale | Weight Machine With Back light LCD Display | White |10 kg | 2 Year Warranty |,Home & Kitchen,249.0,7890.0,3.8,10
Shalimar Premium OXO - Biodegradable Garbage Bags (Medium) Size 48 cm x 56 cm 4 Rolls 120 Bags Dustbin Bag/Trash Bag - Black Color,Home & Kitchen,309.0,18372.0,4.0,11
Godrej aer Matic Kit (Machine + 1 Refill) - Automatic Room Fresheners with Flexi Control Spray | Violet Valley Bloom | 2200 Sprays Guaranteed | Lasts up to 60 days (225ml),Home & Kitchen,474.0,20942.0,4.1,12
"Wakefit Microfiber Height Adjustable Hollow Fibre Sleeping Pillow With Zip | Set of 2 (White And Grey,  27 X 16 Inches)",Home & Kitchen,767.0,65246.0,4.4,13
"Pigeon Amaze Plus Electric Kettle 1.5 L, 1500 Watt, Stainless Steel Body with Auto Shut-off Feature Used for Boiling Water - (Silver)",Home & Kitchen,550.0,148862.0,3.9,14
"Spenfrone Multi-Purpose 360° Rotating Organizer Tray/Kitchen Organizer/Multi- Function Rotating Tray/Cosmetics Organizer (Cream, Pack of 1)",Home & Kitchen,98.0,3494.0,3.9,15
"Clazkit Plastic Kitchen Dori Handy Vegetable and Fruit Manual Onion Dry Fruit Salad Maker Vegetable Quick String Chopper Machine, Cutter – 3 Stainless Steel Blades, 550ml,(Color May Vary)",Home & Kitchen,100.0,114.0,3.6,16
"Wakefit 100% Waterproof Premium Cotton Mattress Protector | Breathable and Hypoallergenic Ultra Soft Fitted Bed Protector 78""x72"" - King, Grey",Home & Kitchen,956.0,91651.0,4.4,17
Woxxin Stitch Pedal Waste Bin Modern Design Trash Can Plastic Dustbin - 7L (MULTICOLOR),Home & Kitchen,,346.0,3.9,18
Shalimar Premium OXO - Biodegradable Garbage Bags 24 X 32 Inches (Large) 60 Bags (4 rolls) Dustbin Bag/Trash Bag - Black Color,Home & Kitchen,329.0,6532.0,4.0,19
"Presto! Oxo-Biodegradable Garbage Bags, Large (24 x 32 inches) - 15 bags/roll (Pack of 6, Black, plastic)",Home & Kitchen,329.0,10051.0,4.3,20
"Odonil Room Air Freshner Spray, Rose Garden - 220 ml | Nature inspired fragrance for Home & Office | Long Lasting Fragrance",Home & Kitchen,100.0,1492.0,4.2,21
"Chillyfit Wall Hooks for Hanging Strong, 10 Pack Adhesive Hooks for Wall Heavy Duty, Wall hangings, Kitchen Accessories Items, Clothes Hanging, Stainless Steel, Transparent",Home & Kitchen,229.0,11699.0,4.1,22
Beco Eco Friendly Biodegradable OXO Garbage Bags for Dustbin | 90 Pcs | Medium 19 X 21 Inches | Pack of 3 | Green,Home & Kitchen,173.0,224.0,3.7,23
"Philips 9-Watts Multipack B22 LED Cool Day White LED Bulb, Pack of 2, (Ace Saver)",Home & Kitchen,139.0,27185.0,4.1,24
Godrej aer Matic Refill - Automatic Room Fresheners | Violet Valley Bloom | 2200 Sprays Guaranteed | Lasts up to 60 days (225ml),Home & Kitchen,270.0,12767.0,4.2,25
"STATUS Memory Foam Bath Mat Rug, Ultra Soft and Non-Slip Bathroom Rugs, Water Absorbent and Machine Washable Bath Rug for Bathroom, Shower, and Tub, 16"" x 24"" (Blue)",Home & Kitchen,199.0,1314.0,,26
"Kadio Analog 20 cm X 20 cm Wall Clock (White, with Glass, Standard)",Home & Kitchen,169.0,2212.0,4.1,27
"Tosaa 18 Pcs - 3 Different Size Plastic Food Snack Bag Pouch Clip Sealer Large,Medium,Small Plastic Snack Seal Sealing Bag Clips Vacuum Sealer (Multicolor)",Home & Kitchen,59.0,1874.0,4.1,28
"Eveready 9W B22 LED Cool Day Light Bulb, Pack of 2, (8901691014272)",Home & Kitchen,129.0,21211.0,4.0,29
"rts Dual USB Universal Travel Adapter, International All in One Worldwide Travel Adapter and Wall Charger with USB Ports with Multi Type Power Outlet USB 2.1A,100-250 Voltage Travel Charger (Black)",Home Improvement,587.0,11998.0,4.2,1
"Spotzero by Milton Prime Spin Mop with Big Wheels and Stainless Steel Wringer, Bucket Floor Cleaning and Mopping System,2 Microfiber Refills,Aqua Green",Home Improvement,,81655.0,4.2,2
"Ceptics UK Adapter for Indian Pins, India to UAE, Hong Kong, Dubai, UK Adapter Plug - Type G Adapter - Perfect for Laptop, Camera, Chargers - CE - RoHS - 3 Pack -White- 5 Years Warranty",Home Improvement,799.0,30980.0,4.3,3
"GM 3060 E-Book 4 + 1 Power Strip Red & White Color 240 Volts with Master Switch, Indicator, Safety Shutter & 4 International sockets, Extension Cord for Home Appliances",Home Improvement,449.0,55519.0,4.0,4
"Plantex GI Steel Self-Adhesive Multipurpose Bathroom Shelf with Hooks/Towel Holder/Rack/Bathroom Accessories-Wall Mount - Pack of 1 (Black,Powder Coated)",Home Improvement,379.0,2383.0,4.2,5
"Scotch-Brite 2-in-1 Bucket Spin Mop (Green, 2 Refills), 4 Pcs",Home Improvement,,41729.0,4.2,6
"Raxon Innovation PVC Door Guard (39 Inches, Pack of 3) Gap Filler for Door Bottom Seal Strip - Sound-Proof, Reduce Noise, Energy Saving Door Stopper for Reduce Door Dust, Insects Protector (Brown)",Home Improvement,129.0,2928.0,3.9,7
"Scotch-Brite No-Dust Broom, Long handle, Easy floor cleaning (Multi-use)",Home Improvement,285.0,33050.0,4.1,8
"Dotcom LED Mini COB Flashlights 1000 High Lumens Bright Light Keychain Flashlight Portable USB Rechargeable Light 3 Light Modes with Folding Bracket,Bottle Opener for Fishing Walking Camping（Square）",Home Improvement,149.0,411.0,3.4,9
Tidy Home Cellulose Cleaning Sponge for Home & Kitchen - Pack of Multicolour Wipes,Home Improvement,210.0,1135.0,4.1,10
"Scotch-Brite Sponge Wipe reusable superior quality kitchen cleaning sponge-Trusted performance, Easy to use, Low maintenance, multi-surface safe and 100% Biodegradable (pack of 5)",Home Improvement,305.0,21737.0,4.0,11
"Scotch-Brite Rubber Heavy Duty Hand gloves for Dishwashing, gardening, kitchen cleaning ( Inner cotton lining for comfort), 1 Pair",Home Improvement,155.0,30513.0,4.0,12
"U.P.C. Upgraded Hands-Free Squeeze Microfiber Flat Spin Mop System 360° Flexible Head (38X12.5 cm) with 1 Super-absorbent Microfiber Pads, 59.8'' Extended Stainless Steel Handle - Green.",Home Improvement,999.0,19184.0,3.7,13
"SOFTSPUN Microfiber Cleaning Cloths, 4pcs 40x40cms 340GSM Multi-Colour! Highly Absorbent Lint and Streak Free Multi -Purpose Wash Cloth for Kitchen Car Window Stainless Steel Silverware.",Home Improvement,247.0,22498.0,4.3,14
"ELECTOMANIA ® Plastic Retractable Handheld Bidet Portable of Antislip, Bidet Angled Nozzle Spray with Travel Bag (Green, 500ML)",Home Improvement,449.0,808.0,4.1,15
"Plantex Advance Self-Adhesive Shelf/Storage Organizer for Bathroom and Kitchen Corner Walls (Powder Coated Black/Pack of 2), Metal",Home Improvement,615.0,2752.0,4.3,16
"Scotch-Brite Sponge Wipe reusable superior quality kitchen cleaning sponge-Trusted performance, Easy to use, Low maintenance, multi-surface safe and 100% Biodegradable (pack of 3)",Home Improvement,185.0,16929.0,4.4,17
"Konquer TimeS KTS Automatic Wireless Water Can Dispenser Pump for 20 Litre Bottle Can, White/Black",Home Improvement,379.0,2506.0,3.9,18
"Spotzero By Milton Spin Mop Spares set Handle with Microfibers Refill(Compatible with Prime, E-elite, Classic, Ace Mops) (DCPDFLR076ASSR0024) (Aqua Green)",Home Improvement,549.0,5102.0,3.7,19
"Rushwak Multifunctional Screen Brush 2 in 1 Mesh Cleaning Brush & Wiper with Extended Handle Window Cleaning Brush Net Cleaner Double-Sided Window Cleaner Window Mesh Cleaner, Multi Color, Pack of 1",Home Improvement,299.0,3282.0,3.9,20
"OREI Worldwide Universal Travel Adapter with Dual USB Ports (2.1A Smart Plug Charging) - All-in-One, 100V-250V Plug - International Plug Adapter for Cell Phones, Tablets, Camera - 5 Years of Warranty",Home Improvement,,8554.0,4.3,21
"wolpin Kitchen Wall Stickers Wood Wallpaper DIY PVC Shelf Liner, Furniture, Almirah, Table Top, Wardrobe, Kitchen Cupboard Decal, Mahogany Brown",Home Improvement,210.0,32584.0,4.0,22
"Dargoba Bathroom Accessories 2 Pack, Bathroom Organizer, Bathroom Rack, Bathroom Shelf for Wall, Bathroom Stand, self Adhesive Bathroom Shelf, washroom Accessories, Bathroom Racks and Shelves",Home Improvement,297.0,62.0,4.4,23
Scotch-Brite Silver Sparks Scrub Pad 2.75x4 (Pack of 6),Home Improvement,79.0,2811.0,4.4,24
"Radiant Door Dust Air Sound Stopper for Home (Size-36), Brown",Home Improvement,59.0,3463.0,3.8,25
"Styxon/Sink Faucet Sprayer Attachment 360 Rotatable Kitchen Tap Head Replacement,Anti-Splash Faucet Nozzle Head with Hose and Universal Connector, 6.5 X 10 X 1 Inch, Silver",Home Improvement,352.0,1041.0,4.1,26
Scotch-Brite 1 Stainless Steel Scrubber (15g) and 2 Scrub pads Combo,Home Improvement,35.0,7192.0,4.3,27
"Scotch-Brite Bathroom Brush with abrasive scrubber for superior tile cleaning (Green,Pack of 1)",Home Improvement,125.0,23342.0,4.2,28
"Gala No Dust Floor Broom XL (Modular,1 Piece)",Home Improvement,199.0,8048.0,4.0,29
THEMISTO TH-T08 8 IN 1 COMBINATION SCREWDRIVER SET (pack of 8),Home Improvement,189.0,134.0,4.3,30
"Philips 9-Watts Multipack B22 LED Cool Day White LED Bulb, Pack of 2, (Ace Saver)",Industrial & Scientific,139.0,27185.0,4.1,1
"Eveready 9W B22 LED Cool Day Light Bulb, Pack of 2, (8901691014272)",Industrial & Scientific,129.0,1874.0,4.0,2
"Konvio Neer Imported Total Dissolved Solids Meter, Water Quality Tester, PPM Tester For Household Drinking Water, Swimming Pools, Aquariums, Hydroponics and more(1)",Industrial & Scientific,299.0,33555.0,4.4,3
Themisto TH-TDS10 Digital TDS Meter,Industrial & Scientific,136.0,1446.0,4.2,4
"Dr.Fixit Kwik N Ezee. Ready to Use Gap and Crack Filler, 150gm (White), DIY Waterproofing for Home Use, Tile Grout and Sealant for Tiles, Concrete, Metal, PVC, Wood, Suitable for Wet & Damp areas",Industrial & Scientific,329.0,3199.0,3.8,5
"ASGARD Nonwoven Fabric Disposable Surgical Mask 3Ply for Unisex (Pack of 50, Pink Polka)",Industrial & Scientific,299.0,8634.0,4.3,6
"Pidilite WD 40, 500 ml Smart Straw Spray, for Multi Use & Pidilite T16 Roff Cera Clean Professional Tile, Floor & Ceramic Cleaner 1 litre",Industrial & Scientific,570.0,9084.0,4.0,7
"Panasonic 9W LED Bulb | LED Bulb 9 watt with B22 Base | 4kV Surge Protection 9 Watt Bulb (Cool Day Light, Pack of 4)",Industrial & Scientific,399.0,700.0,4.1,8
HONOLY Leakage Repair Waterproof Tape for Pipe Leakage Roof Water Leakage Solution Aluminium Foil Tape Waterproof Adhesive Tape Sealing Butyl Rubber Tape for Leakage (5CM*5M (Pack Of 1)),Industrial & Scientific,299.0,3585.0,3.7,9
"amazon basics - 40W LED Bulb, Cool White (Base B22, Pack of 1)",Industrial & Scientific,439.0,1251.0,4.0,10
"Bajaj LEDZ 8.5W Rechargeable Emergency Inverter LED Bulb, Cool Day Light, White, Upto 4 Hours Battery",Industrial & Scientific,289.0,196.0,3.8,11
Aptechdeals IPA ISO PROPYL ALCOHOL (99.9% Pure) (CH3)2-CH-OH,Industrial & Scientific,109.0,4450.0,4.3,12
"3M 1110 Ear Plugs Corded, Extra Soft, Reusable Earbuds Noise Cancellation, Soundproof Earplug Use For Underwater, Meditation, Study, Flight Travel, Sleeping, Sound Block Up To 29 Decibel (Pack of 5)",Industrial & Scientific,85.0,24498.0,3.8,13
Dr Trust Plastic Bestest Compressor Nebulizer Machine Kit (White) Pack Of 1,Industrial & Scientific,,23767.0,4.2,14
"ASGARD Melt-Blown Fabric Disposable Face Mask with Nose Clip (Blue, Pack of 100) for Unisex",Industrial & Scientific,299.0,38105.0,4.2,15
